47227609000161,"BOCAINA WE CAPITAL FUNDO DE INVESTIMENTO FINANCEIRO","Bocaina",-5.6232,-7.5623,-3.9873,-1.947,-0.9072
47443943000152,"SPARK FUNDO DE INVESTIMENTO FINANCEIRO RENDA FIXA","BTG Asset",64.8506,11.5318,16.5249,8.0689,3.7599
47457832000103,"BOCAINA BG FUNDO DE INVESTIMENTO RENDA FIXA","Bocaina",103.5168,85.7278,41.0534,20.0458,9.3409
47540095000108,"ICATU VANGUARDA ABSOLUTO B FIFE FIF - CLASSE DE INVESTIMENTO MUL CRÉDITO PRIVADO - RESP LIMITADA","Icatu",123.7739,115.0141,55.5213,27.1103,12.6329
47543107000140,"RIO GRANDE ABSOLUTO FIF RENDA FIXA CRÉDITO PRIVADO PREVIDENCIÁRIO - RESP LIMITADA","Icatu",114.4977,103.7327,50.5569,24.6862,11.5033
47543238000127,"ONZE ICATU PREV FIFE FI FINANCEIRO - CI RF CRED PRIV - RESP LIMITADA","Onze",203.2687,135.694,64.8217,31.6515,14.749
47586388000118,"OCCAM CRÉDITO CORPORATIVO 30 MASTER FIF RENDA FIXA CRED PRIV LONGO PRAZO - RESPONSABILIDADE LIMITADA","Occam",124.4206,120.8153,59.0552,28.8358,13.4369
47586503000154,"OCCAM BP PREVIDÊNCIA FI FINANCEIRO RENDA FIXA CRÉDITO PRIVADO - RESPONSABILIDADE LIMITADA","Occam",114.8708,109.3538,53.3001,26.0257,12.1275
47612777000170,"ABSOLUTE ATENAS PREVIDÊNCIA FUNDO DE INVESTIMENTO FINANCEIRO RENDA FIXA","Absolute",98.5602,105.9963,53.2657,26.0089,12.1196
47628822000185,"ABSOLUTE ATENAS MASTER FUNDO DE INVESTIMENTO FINANCEIRO RENDA FIXA","Absolute",94.2604,104.1035,51.9804,25.3813,11.8272
47628918000143,"ABSOLUTE CRETA MASTER FUNDO DE INVESTIMENTO FINANCEIRO RENDA FIXA","Absolute",105.8231,115.5305,58.2898,28.4621,13.2628
47715736000100,"SULAMÉRICA EXCELLENCE MASTER FIF RENDA FIXA CRÉDITO PRIVADO DE RESPONSABILIDADE LIMITADA","Sulamérica",103.3602,103.1107,50.7029,24.7575,11.5365
47728212000153,"KILIMA MOTO PREV FUNDO DE INVESTIMENTO RENDA FIXA CRÉDITO PRIVADO RESPONSABILIDADE LIMITADA","Monte Bravo",21.4454,87.4334,46.0457,22.4835,10.4769
47729760000106,"VLGI ASSET DI FUNDO DE INVESTIMENTO EM RENDA FIXA CRÉDITO PRIVADO","VLGI",115.3589,108.2329,52.3546,25.564,11.9123
48411732000109,"ROOT CAPITAL HIGH YIELD RADICE FIF MULTIMERCADO CRÉDITO PRIVADO IE - RESPONSABILIDADE LIMITADA","Root",170.0931,145.2338,74.0825,36.1734,16.8561
48658513000110,"XP CORPORATE TOP PREV XP SEGUROS MASTER FIF RF CRÉDITO PRIVADO RESPONSABILIDADE LIMITADA","XPG",118.4792,112.0615,55.8755,27.2832,12.7134
48948661000170,"NEST MACAW RF FIFE ICATU PREVIDENCIÁRIO FIF - CLASSE DE INVESTIMENTO RF CRED PRIV - RESP LIMITADA","Nest",101.9078,93.105,45.9497,22.4366,10.455
48953198000154,"ICATU VANGUARDA CREDIT PLUS VC FIF - CLASSE DE INVESTIMENTO RF CRED PRIV - RESP LIMITADA","Icatu",143.7983,128.8224,62.7528,30.6413,14.2783
48975466000139,"VINCI FIFE FIF - CLASSE DE  INVESTIMENTO RENDA FIXA CRÉDITO PRIVADO - - RESPONSABILIDADE LIMITADA","Vinci",111.8729,113.8531,56.9295,27.7979,12.9533
48986296000198,"ABSOLUTE OLIMPIA MASTER FUNDO DE INVESTIMENTO FINANCEIRO MULTIMERCADO","Absolute",98.915,109.7955,57.1493,27.9052,13.0033
49077283000169,"NOVA PATAGONIA FUNDO DE INVESTIMENTO MULTIMERCADO CRÉDITO PRIVADO","Oriz",100.3987,92.9101,42.8985,20.9467,9.7608
49124184000190,"BTG NEXT FUNDO DE INVESTIMENTO FINANCEIRO MULTIMERCADO","BTG WM",114.2401,113.556,55.8852,27.2879,12.7156
49178674000170,"BTG PACTUAL CONSÓRCIO FUNDO DE INVESTIMENTO FINANCEIRO RENDA FIXA REFERÊNCIA DI","BTG Asset",93.4002,95.911,46.9136,22.9072,10.6743
49227505000182,"H7 PREV FUNDO DE INVESTIMENTO MULTIMERCADO CRÉDITO PRIVADO RESPONSABILIDADE LIMITADA","XPG",224.4997,207.6503,68.7184,33.5629,15.646
49269925000121,"SANTANDER PREV MULTIESTRATÉGIA RENDA FIXA CRÉDITO PRIVADO LONGO PRAZO - FIF RESP LIMITADA","SAM",208.4032,119.0334,45.358,22.1477,10.3204
49270021000116,"SBPREV I MASTER RENDA FIXA CRÉDITO PRIVADO - FIF RESP LIMITADA","SAM",106.8184,106.841,51.7587,25.2731,11.7768
49328341000180,"SAFRA PREV VITESSE MASTER FIF PREVIDENCIÁRIO CI RENDA FIXA CRÉDITO PRIVADO PREV RESP LIMITADA","Safra Asset",104.7415,106.2775,50.2953,24.5585,11.4438
49366532000136,"ROOT CAPITAL HIGH YIELD PREVIDÊNCIA FIF RENDA FIXA CRÉDITO PRIVADO - RESPONSABILIDADE LIMITADA","Root",189.7469,143.3481,66.6781,32.558,15.1714
49438428000100,"AZ QUEST LUCE PREVIDENCIARIO MASTER II FIFE FIF RENDA FIXA CRÉDITO PRIVADO - RESP LTDA","AZ Quest",117.3517,107.4926,51.7279,25.258,11.7697
49460236000108,"CADENZA HIGH YIELD IQ MASTER FUNDO DE INVESTIMENTO FINANCEIRO MULTIMERCADO","Paramis",150.9989,128.3858,52.3773,25.5751,11.9175
49558667000101,"ABSOLUTE DELFOS PREV ITAÚ MASTER FIF RENDA FIXA CRÉDITO PRIVADO RESP LIMITADA","Absolute",100.0626,112.6129,58.3265,28.48,13.2711
49559434000115,"ABSOLUTE ATENAS PREV ITAÚ MASTER FIF RENDA FIXA CRÉDITO PRIVADO RESPONSABILIDADE LIMITADA","Absolute",105.729,114.6306,57.4025,28.0288,13.0609
49633643000161,"BRASILPREV ITAÚ SINFONIA PREV FIF RENDA FIXA CRÉD PRIV RESP LIMITADA","IAM",108.5014,111.1173,51.3159,25.0569,11.676
49647912000149,"LIGA SOLIDÁRIA FUNDO DE INVESTIMENTO FINANCEIRO MULTIMERCADO","UBS",149.6664,96.402,44.8959,21.9221,10.2153
49768506000134,"PREVI RENDA FIXA HIGH GRADE IPCA FUNDO DE INVESTIMENTO FINANCEIRO CRÉDITO PRIVADO RESP LIMITADA","Previ",185.7874,105.1111,36.4608,17.8033,8.296
49818870000161,"SPARTA PREV B MASTER FUNDO DE INVESTIMENTO FINANCEIRO RENDA FIXA","Sparta",107.3186,105.4236,51.6474,25.2187,11.7514
49851069000118,"DAYCOVAL ANS FUNDO DE INVESTIMENTO FINANCEIRO","Daycoval",101.3828,105.119,51.7966,25.2915,11.7854
49924950000100,"TYTON CRÉDITO HIGH YIELD FUNDO DE INVESTIMENTO FINANCEIRO MULTIMERCADO","Tyton",120.8514,110.4585,39.4123,19.2445,8.9676
49931360000104,"PFTM PREVIDENCIÁRIO ICATU QUALIFICADO FI FINANCEIRO - CI MULT CRED PRIV - RESP LIMITADA","UBS",194.6848,56.1332,20.7013,10.1081,4.7102
49933828000191,"BRAVE PREVIDÊNCIA FIFE FUNDO DE INVESTIMENTO RENDA FIXA CRÉDITO PRIVADO","Brave",106.0921,106.6552,52.1912,25.4843,11.8752
49977033000185,"MIRABAUD TRADITION FI FINANCEIRO - CI RF CRED PRIV - RESP LIMITADA","Mirabaud",105.4934,107.1804,51.9963,25.389,11.8308
49980566000116,"ITAÚ FLEXPREV ADVANCED FIF MULT CRED PRIV - RESP LIMITADA","IAM",116.2511,112.5808,53.2885,26.0234,12.1288
50006439000108,"FP FOF JGP CORPORATE FI FINANCEIRO - CI RF CRED PRIV - RESP LIMITADA","JGP",123.8029,111.53,56.8361,27.7523,12.932
50069605000107,"FP FOF SPARTA TOP FI FINANCEIRO - CI RF CRED PRIV - RESP LIMITADA","Sparta",103.6405,103.7341,50.7876,24.7989,11.5558
50112294000111,"BOCOM BBM CASH ENHANCED FIF CLASSE DE INVESTIMENTO RFCRED PRIV - RESP LIMITADA","BBM Asset",105.736,105.7812,52.0409,25.4109,11.841
50128371000121,"LIGA FI FINANCEIRO - CI MULT CRED PRIV - RESP LIMITADA","BTG WM",133.7981,73.6115,34.6151,16.902,7.876
50223269000105,"MAG HIGH GRADE FIF CLASSE DE INVESTIMENTO RENDA FIXA CRÉDITO PRIVADO LONGO PRAZO RESP LIMITADA","MAG",113.4522,106.6314,52.1614,25.4697,11.8684
50326147000144,"KINEA INSTITUCIONAL FUNDO DE INVESTIMENTO FINANCEIRO RENDA FIXA CRÉD PRIV LONGO PRAZO RESP LIMITADA","Kinea",107.449,107.3548,52.079,25.4294,11.8496
50514867000133,"BOCOM BBM OAWM 30 FIF - CLASSE DE INVESTIMENTO MULTIMERCADO LONGO PRAZO CRÉDITO PRIVADO - RESP LTDA","BBM Asset",110.5377,106.4012,52.5767,25.6725,11.9629
50553108000180,"RAFTER ICATU PREVIDENCIÁRIO QUALIFICADO FI FINANCEIRO - CI MULT CRED PRIV - RESP LIMITADA","Rafter",174.8254,26.289,14.1038,6.8867,3.2091
50622383000108,"PANAMBY HIGH GRADE D5 FUNDO DE INVESTIMENTO FINANCEIRO RENDA FIXA","PNBY",141.1174,119.2767,64.3655,31.4288,14.6452
50677561000106,"STUTTGART FUNDO DE INVESTIMENTO FINANCEIRO MULTIMERCADO","Rubik",376.63,152.2059,28.2315,13.7851,6.4236
50697486000137,"MAG HIGH GRADE PLUS 30 FIF RENDA FIXA CRÉDITO PRIVADO LONGO PRAZO - RESPONSABILIDADE LIMITADA","MAG",108.216,107.9283,52.5935,25.6807,11.9667
50717653000164,"SERRA 83 PREVIDÊNCIA FUNDO DE INVESTIMENTO FINANCEIRO MULTIMERCADO","BTG WM",240.9729,112.2057,45.229,22.0847,10.291
50765209000114,"RA CLASSE DE INVESTIMENTO MULTIMERCADO CRÉDITO PRIVADO - RESP LIMITADA","Gauss",4.4011,4.0761,2.047,0.9995,0.4657
50765883000107,"FUNSSEST ESTRATÉGIA II FUNDO DE INVESTIMENTO FINANCEIRO RENDA FIXA","Icatu",110.233,109.989,51.9851,25.3836,11.8283
50799566000101,"FUNSSEST ESTRATÉGIA I FUNDO DE INVESTIMENTO FINANCEIRO RENDA FIXA","Vinci",125.6648,113.6029,54.0911,26.4119,12.3074
50803491000187,"BRASILPREV TOP RENDA FIXA SUPREME FIF RESPONSABILIDADE LIMITADA","BB Asset",100.052,100.9544,48.5173,23.6903,11.0392
50820465000167,"BTG LEGATO PREV FIFE FUNDO DE INVESTIMENTO FINANCEIRO MULTIMERCADO","BTG Asset",105.7885,98.4452,51.2228,25.0114,11.6548
50825877000190,"PEACE FUNDO DE INVESTIMENTO FINANCEIRO RENDA FIXA","BTG WM",148.8034,98.7238,45.4629,22.1989,10.3442
50874219000198,"BTG PACTUAL CRÉDITO CORPORATIVO MASTER III FUNDO DE INVESTIMENTO RENDA FIXA CRÉDITO PRIVADO","BTG Asset",132.1107,119.7626,56.7557,27.713,12.9137
50925001000115,"TAGUS ICATU FUNDO DE INVESTIMENTO FINANCEIRO RENDA FIXA","Tagus",119.8151,104.9561,54.7233,26.7206,12.4513
51041048000189,"TRF CLASSE DE INVESTIMENTO MULTIMERCADO  CRÉDITO PRIVADO - RESP LIMITADA","Turim",103.1196,103.8544,47.101,22.9988,10.717
51075995000190,"AUGME VINTAGE I CLASSE DE INVESTIMENTO  RENDA FIXA CRÉDITO PRIVADO - RESP LIMITADA","Augme",-607.9066,-64.2026,-50.3087,-24.565,-11.4468
51168708000197,"FUNDO DE INVESTIMENTO FINANCEIRO MULTIMERCADO LT","BTG Asset",1106.3471,-77.1358,-80.0892,-39.1064,-18.2228
51200543000193,"SAFRA PREV RENDA FIXA FIF PREVIDENCIÁRIO CI RENDA FIXA CRÉDITO PRIVADO PREV RESP LIMITADA","Safra Asset",98.0489,100.7821,49.1899,24.0187,11.1923
51234049000140,"COMPASS HIGH GRADE ICATU PREVIDENCIA FIFE FUNDO DE INVESTIMENTO FINANCEIRO RENDA FIXA","Vinci",112.5029,112.6805,46.8422,22.8872,10.6758
51238218000110,"BTG PACTUAL CREDITO CORPORATIVO BRASILPREV PREVIDENCIA FUNDO DE INVESTIMENTO FINANCEIRO MULTIMERCADO","BTG Asset",125.5908,117.1184,55.1404,26.9243,12.5462
51289474000136,"BRADESCO HUB ULTRA FIFE FI FINANCEIRO - CI RF CRED PRIV - RESP LIMITADA","BRAM",105.0679,106.5126,51.4974,25.1455,11.7173
51378137000115,"UNIMED INVESTCOOP LIVRE II FIF RENDA FIXA CRÉDITO PRIVADO LONGO PRAZO RESP LIMITADA","Sparta",108.1723,106.5549,52.3267,25.5504,11.906
51538282000116,"OCCAM BRASILPREV PREVIDÊNCIA FI FINANCEIRO RENDA FIXA CRÉDITO PRIVADO - RESPONSABILIDADE LIMITADA","Occam",123.1923,116.4722,57.6136,28.1319,13.1089
51556889000129,"FINANCE BLUE FUNDO DE INVESTIMENTO MULTIMERCADO CRÉDITO PRIVADO","XPG",117.8716,99.1803,47.1848,23.0397,10.7361
51623321000183,"BTG LEGATO L FUNDO DE INVESTIMENTO FINANCEIRO MULTIMERCADO","BTG Asset",130.3274,119.1681,50.5964,24.7055,11.5123
51714018000196,"BP SFA FUNDO DE INVESTIMENTO FINANCEIRO MULTIMERCADO","BTG WM",100.0293,100.9136,48.9958,23.924,11.1481
51726488000170,"RUBIK RELIANCE FUNDO DE INVESTIMENTO FINANCEIRO MULTIMERCADO","Rubik",77.7546,95.0522,48.1995,23.5352,10.9669
51800853000149,"BTG LEGATO PMFO FUNDO DE INVESTIMENTO FINANCEIRO MULTIMERCADO","BTG Asset",126.5364,134.7269,64.2305,31.3628,14.6145
51825326000199,"SVN FUNDO DE INVESTIMENTO FINANCEIRO RENDA FIXA CRÉDITO PRIVADO - RESPONSABILIDADE LIMITADA","SVN",156.367,116.344,48.3285,23.5981,10.9963
51853123000106,"SPARTA BWM FUNDO DE INVESTIMENTO FINANCEIRO RENDA FIXA CRÉDITO PRIVADO - RESPONSABILIDADE LIMITADA","Sparta",103.8103,108.5364,53.4851,26.116,12.1696
51863123000197,"SULA FRANKFURT ESG FIF - CLASSE DE INVESTIMENTO RF CRED PRIV INVEST SUSTENTÁVEL - RESP LIMITADA","Sulamérica",111.9296,108.461,53.1636,25.9591,12.0964
51863845000141,"BTG MUNIQUE FI FINANCEIRO - CI RF CRED PRIV - RESP LIMITADA","BTG Asset",134.0784,119.5989,59.0952,28.8554,13.446
51885543000174,"GLPG HAMBURGO FUNDO DE INVESTIMENTO FINANCEIRO - CLASSE DE INVESTIMENTO RF CRED PRIV - RESP LIMITADA","Galapagos",168.5617,114.1175,57.6435,28.1465,13.1157
51903744000157,"BRAIN CORPORATIVO 30 FUNDO DE INVESTIMENTO FINANCEIRO RENDA FIXA CRÉDITO PRIVADO","Brainvest",110.7,109.9763,54.5392,26.6307,12.4094
51977823000102,"CATTUS FUNDO DE INVESTIMENTO FINANCEIRO RENDA FIXA","Starboard",929.5981,704.0693,181.8885,88.8136,41.3854
52115449000107,"ROOT CAPITAL CRÉDITO HG INSTITUCIONAL FIF RENDA FIXA CRÉDITO PRIVADO - RESPONSABILIDADE LIMITADA","Root",127.9802,112.5049,54.0241,26.3792,12.2922
52155255000127,"CONDUS FUNDO DE INVESTIMENTO MULTIMERCADO","Sonata",168.9641,107.3425,46.6702,22.7884,10.6189
52204076000132,"KINEA VII FUNDO DE INVESTIMENTO FINANCEIRO RENDA FIXA CRÉDITO PRIVADO RESP LIMITADA","Kinea",125.2258,127.2999,54.6953,26.7069,12.4449
52221407000142,"SPARTA OPPORTUNITY FIF RENDA FIXA CRÉDITO PRIVADO LONGO PRAZO - RESPONSABILIDADE LIMITADA","Sparta",104.4718,104.9598,51.1322,24.9672,11.6342
52225340000114,"CAIXA CVP FIF RENDA FIXA CRÉDITO PRIVADO ASG INVESTIMENTO SUSTENTÁVEL - IS - RESP LIMITADA","CEF Asset",101.4346,105.3514,54.4949,26.6091,12.3993
52237532000140,"OCCAM CRÉDITO CORPORATIVO INSTITUCIONAL 30 FIF RENDA FIXA CRÉDITO PRIVADO -RESPONSABILIDADE LIMITADA","Occam",127.0162,112.2499,54.7382,26.7279,12.4547
52241587000124,"KINEA NEPAL FIF MULT CRED PRIV - RESP LIMITADA","Kinea",121.5968,115.191,55.0838,26.8966,12.5333
52249657000190,"LUMBER PREVIDÊNCIA FUNDO DE INVESTIMENTO MULTIMERCADO CRÉDITO PRIVADO RESPONSABILIDADE LIMITADA","BTG WM",191.4262,121.6075,49.5217,24.1808,11.2678
52268697000180,"BRUMA PREVIDÊNCIA FUNDO DE INVESTIMENTO MULTIMERCADO CRÉDITO PRIVADO RESPONSABILIDADE LIMITADA","BTG WM",268.3249,41.5612,15.5984,7.6165,3.5491
52272566000176,"PORTFOLIO III RF INFLAÇÃO INCENTIVADA FUNDO DE INVESTIMENTO EM INFRAESTRUTURA RENDA FIXA","XPG",0,134.4232,11.9286,5.8283,2.7186
52272574000112,"ROOT CAPITAL CRÉDITO HG BRASILPREV FIF RENDA FIXA CRÉDITO PRIVADO - RESPONSABILIDADE LIMITADA","Root",130.5156,113.8983,53.8643,26.3012,12.2558
52273340000190,"CORE CRÉDITO N FIFE FUNDO DE INV FIN RF CRÉDITO PRIV LONGO PRAZO - RESP LIMITADA","Vinland",-36.7218,67.3475,56.8116,27.7403,12.9264
52273351000170,"PORTFOLIO RF II PREV FUNDO DE INVESTIMENTO MULTIMERCADO CRÉDITO PRIVADO RESPONSABILIDADE LIMITADA","XPG",88.9846,-111.1494,-26.7549,-13.064,-6.0876
52280783000108,"DRYS SHELTER MASTER FIF RF CRÉD PRIV LP - RESPONSABILIDADE LIMITADA","Drys",118.1545,112.864,57.0761,27.8694,12.9866
52301436000114,"MIRABAUD CONVICTION FIF - CLASSE DE INVESTIMENTO RENDA FIXA CRÉDITO PRIVADO - RESP LIMITADA","Mirabaud",104.4406,107.4287,51.3375,25.0674,11.6809
52324362000131,"ABSOLUTE DELFOS MASTER FUNDO DE INVESTIMENTO FINANCEIRO RENDA FIXA  LONGO PRAZO","Absolute",104.4348,108.1029,55.4708,27.0856,12.6214
52333139000150,"CARBYNE FUNDO DE INVESTIMENTO MULTIMERCADO CRÉDITO PRIVADO RESPONSABILIDADE LIMITADA","BRM",26.2758,59.2292,55.8167,27.2545,12.7001
52479263000129,"CASH D-30 FUNDO DE INVESTIMENTO FINANCEIRO","EXT",116.8884,115.4614,57.7561,28.2015,13.1413
52580782000189,"SULAMERICA CREDITO ASG BB FIF RF CRED PRIV INVESTIMENTO SUSTENTAVEL - RESPONSABILIDADE LIMITADA","Sulamérica",110.6473,105.285,51.9396,25.3614,11.8179
52771267000186,"BRADESCO FIF - CLASSE DE  INVESTIMENTO MULTIMERCADO CRÉDITO PRIVADO FRIGOR","BRAM",107.2002,105.0337,51.6378,25.214,11.7492
52840769000111,"JGP CRÉDITO PREVIDENCIÁRIO DINÂMICO FUNDO DE INVESTIMENTO MULTIMERCADO CRÉDITO PRIVADO RESP LIMITADA","JGP",158.5777,118.2527,69.9651,34.163,15.9193
52954432000135,"LONDRES PREVIDÊNCIA FUNDO DE INVESTIMENTO MULTIMERCADO CRÉDITO PRIVADO - RESPONSABILIDADE LIMITADA","Capri",120.0694,104.1994,49.1417,23.9952,11.1813
52955321000143,"SVN PREV FUNDO DE INVESTIMENTO FINANCEIRO RENDA FIXA CRÉDITO PRIVADO - RESPONSABILIDADE LIMITADA","SVN",163.3025,108.3339,42.182,20.5996,9.6009
52986251000190,"ICATU VANGUARDA ABSOLUTO II XP SEG FUNDO DE INVESTIMENTO RENDA FIXA CP PREV - RESP LIMITADA","Icatu",121.9827,105.2678,52.35,25.5618,11.9113
53076690000129,"MIRABAUD ICATU PREV FUNDO DE INVESTIMENTO FINANCEIRO  RENDA FIXA CRÉDITO PRIVADO - RESP LIMITADA","Mirabaud",106.7275,106.0127,50.7974,24.8037,11.558
53076975000160,"STRIX YIELD MASTER FUNDO DE INVESTIMENTO RENDA FIXA","Strix",102.0898,107.7611,53.6099,26.177,12.198
53088893000135,"BTG LEGATO CW2 FUNDO DE INVESTIMENTO MULTIMERCADO","BTG Asset",139.2,106.6551,51.9156,25.3497,11.8124
53212784000188,"BRADESCO FIF RF CRED PRIV BAQUARA ESG IS - RESPONSABILIDADE LIMITADA","BRAM",103.8412,106.605,51.543,25.1677,11.7277
53444176000107,"ICATU VANGUARDA DINÂMICO CDI FIFE FIF MULT CPRIV PREV - RESP LIMITADA","Icatu",144.0693,123.0719,62.1588,30.3513,14.1431
53450033000108,"SAFRA HIGH YIELD MASTER FIF CLASSE DE INVESTIMENTO RENDA FIXA CRÉDITO PRIVADO RESP LIMITADA","Safra Asset",112.8498,111.7222,37.6118,18.081,8.4407
53502091000120,"VICADIA PREVIDÊNCIA FUNDO DE INVESTIMENTO MULTIMERCADO","Brainvest",138.3126,104.7816,47.5577,23.2218,10.8209
53636931000147,"SAFRA PREV HIGH YIELD MASTER FIF PREV CLASSE DE INVESTIMENTO RF CRÉDITO PRIVADO PREV RESP LIMITADA","Safra Asset",107.2276,111.4751,51.2244,25.0122,11.6552
53692814000109,"ALTERA I PREVIDÊNCIA SELEÇÃO CRÉDITO FUNDO DE INVESTIMENTO MULTIMERCADO","Altera",117.4076,111.4711,50.7332,24.7723,11.5434
53726108000122,"CL VI FUNDO DE INVESTIMENTO MULTIMERCADO","Springs",657.438,-527.7723,-204.0895,-99.654,-46.4368
53798986000153,"VINLAND CRÉDITO MASTER INSTITUCIONAL FUNDO DE INVESTIMENTO RENDA FIXA","Vinland",111.5745,110.0866,53.354,26.052,12.1397
53802999000159,"DAYCOVAL CLASSIC MASTER FUNDO DE INVESTIMENTO  FINANCEIRO RENDA FIXA CP LP - RESP LIMITADA","Daycoval",108.1118,109.4411,54.1415,26.4366,12.3189
53819577000196,"AUGME PRO II FUNDO DE INVESTIMENTO FINANCEIRO MULTIMERCADO","Augme",92.0853,98.8418,48.7293,23.7938,11.0875
53828295000155,"RÉGIA EQUILÍBRIO FIF IS RENDA FIXA CRÉDITO PRIVADO LONGO PRAZO - RESPONSABILIDADE LIMITADA","Regia",99.747,104.6286,51.2361,25.0179,11.6578
53847333000117,"TYTON CRÉDITO PREVIDÊNCIA FUNDO DE INVESTIMENTO MULTIMERCADO","Tyton",117.7621,114.0355,55.2176,26.962,12.5638
53857092000197,"SEC FUNDO DE INVESTIMENTO FINANCEIRO RENDA  FIXA CRÉDITO PRIVADO","WIT",124.4092,124.8651,61.4047,29.983,13.9715
53990350000109,"ICATU VANGUARDA ABSOLUTO PLUS QUALIFICADO XP SEG FIRF CRÉDITO PRIVADO PREVIDENCIÁRIO - RESP LIMITADA","Icatu",121.9506,113.2127,55.4888,27.0944,12.6255
53990541000170,"ICATU VANGUARDA DINÂMICO CDI XP SEG FIM CRÉDITO PRIVADO PREVIDENCIÁRIO - RESPONSABILIDADE LIMITADA","Icatu",127.0737,115.8227,60.5629,29.572,13.78
54026114000130,"TRÍADE MASTER FUNDO DE INVESTIMENTO FINANCEIRO MULTIMERCADO","Paramis",129.9058,119.0248,54.5073,26.6151,12.4021
54072658000138,"TRIUNFO FUNDO DE INVESTIMENTO FINANCEIRO RENDA FIXA CRÉDITO PRIVADO - RESPONSABILIDADE LIMITADA","Galapagos",130.3348,110.1711,51.1226,24.9624,11.632
54227728000180,"ITAÚ SINFONIA ALL FUNDO DE INVESTIMENTO FINANCEIRO MULTIMERCADO CRÉD PRIV - RESP LIMITADA","IAM",123.3143,120.8235,54.8054,26.7607,12.47
54277615000199,"TRÍGONO FUNDO DE INVESTIMENTO RENDA FIXA LONGO PRAZO","Trígono",106.7241,89.2303,46.3695,22.6416,10.5505
54333831000104,"SULAMÉRICA CRÉDITO FIFE FUNDO DE INVESTIMENTO FINANCEIRO RF CRÉD PRIV - RESPONSABILIDA LIMITADA","Sulamérica",111.9322,106.7029,52.624,25.6955,11.9736
54347933000189,"UNIÃO INVESTIMENTOS FUNDO DE INVESTIMENTO MULTIMERCADO","BTG WM",107.5321,106.8954,53.0004,25.8794,12.0593
54366569000102,"GALÉS FIF - CLASSE DE INVESTIMENTO RENDA FIXA CRÉDITO PRIVADO DI - RESPONSABILIDADE LIMITADA","BRZ",150.4479,127.2616,63.0448,30.7839,14.3447
54367942000131,"SULAMÉRICA FIFE PREV CRÉDITO ESG FIF RENDA FIXA CRÉDITO PRIVADO IS DE RESPÓNSABILIDADE LIMITADA","Sulamérica",117.8405,110.7792,54.7133,26.7157,12.449
54410516000133,"GHT4 CASH FUNDO DE INVESTIMENTO RENDA FIXA - RESPONSABILIDADE LIMITADA","GHT4",100.8135,100.5281,49.5077,24.1739,11.2646
54440968000168,"FUNDO DE INVESTIMENTO MULTIMERCADO FRATELLI III LONGO PRAZO - CRÉDITO PRIVADO RESPONSABILIDADE LIMIT","Scalare",478.1534,21.9753,-7.5671,-3.6949,-1.7217
54441115000140,"FUNDO DE INVESTIMENTO MULT FRATELLI II LONGO PRAZO - CRÉDITO PRIVADO RESPONSABILIDADE LIMITADA","Scalare",432.099,43.8135,1.6531,0.8072,0.3761
54485055000168,"BRAVE IRON FUNDO DE INVESTIMENTO RENDA FIXA","Brave",104.4651,105.8947,52.069,25.4245,11.8473
54541970000123,"M8 CAPITAL PREVIDÊNCIA FIFE FUNDO DE INVESTIMENTO RENDA FIXA","M8",105.1669,107.1079,52.7249,25.7448,11.9966
54599810000135,"AUDACITAS FIFE PREVIDÊNCIA FI MULTIMERCADO CRÉDITO PRIVADO RESPONSABILIDADE LIMITADA","EQI",117.8831,109.9442,54.3159,26.5217,12.3586
54643280000185,"ITAÚ FLEXPREV SINFONIA DISTRIBUIDORES  FIF MULTIMERCADO CRÉDITO PRIVADO - RESPONSABILIDADE LIMITADA","IAM",111.3647,115.3152,53.6786,26.2105,12.2136
54660721000157,"CORE II CRÉDITO FIF RF CRED PRIV LP - RESP LIMITADA","Vinland",242.2416,95.8547,64.3085,31.4009,14.6322
54713571000100,"PORTO VANTAGE FUNDO DE INVESTIMENTO RENDA FIXA PREVIDENCIARIO","Porto Asset",187.723,110.5857,49.4686,24.1548,11.2557
54776180000127,"AUGME FRG CLASSE DE INVESTIMENTO MULTIMERCADO CRÉDITO PRIVADO - RESP LIMITADA","Augme",278.0117,10.3485,5.2522,2.5646,1.1951
54875709000160,"RÉGIA CORPORATE II FIF IS RENDA FIXA CRÉDITO PRIVADO LONGO PRAZO - RESPONSABILIDADE LIMITADA","Regia",121.9174,118.0707,56.6228,27.6481,12.8835
54888270000100,"PORTO CRÉDITO ITAÚ PREVIDENCIÁRIO MASTER FUNDO DE INVESTIMENTO FIN RF CRÉD PRIVADO - RESP LIMITADA","Porto Asset",113.6987,110.3673,51.3582,25.0775,11.6856
54973853000139,"SPARTA VP FUNDO DE INVESTIMENTO RENDA FIXA","Sparta",109.9324,107.7723,52.8171,25.7899,12.0176
55035529000132,"FRG FIF - CLASSE DE INVESTIMENTO MULTIMERCADO CRÉDITO PRIVADO - RESPONSABILIDADE LIMITADA","BRAM",114.3742,110.5078,53.8578,26.298,12.2544
55064130000180,"COMODORO FUNDO DE INVESTIMENTO MULTIMERCADO","BTG WM",102.5779,104.5568,51.5451,25.1688,11.7282
55087532000108,"KINEA CRÉDITO PRIVADO IX RENDA FIXA FUNDO DE INVESTIMENTO FINANCEIRO RENDA FIXA - RESP LIMITADA","Kinea",112.7939,117.3677,55.7663,27.2299,12.6886
55110376000140,"VINCI CREDITO PREV FIF RENDA FIXA CREDITO PRIVADO FIFE - RESPONSABILIDADE LIMITADA","Vinci",115.6672,109.9563,55.944,27.3167,12.729
55140702000162,"AUGME PRO III FUNDO DE INVESTIMENTO FINANCEIRO MULTIMERCADO","Augme",104.7385,105.6467,50.3575,24.5889,11.4579
55161795000101,"COMMANDER PREVIDÊNCIA ICATU CLASSE DE INVESTIMENTO RENDA FIXA CRÉDITO PRIVADO - RESPONSABILIDADE LIM","Global",113.3461,107.5272,53.8129,26.2761,12.2441
55193005000170,"SANTANDER CRESCIMENTO INSTITUCIONAL MASTER RENDA FIXA CRÉDITO PRIVADO FIF RESP LIMITADA","SAM",110.0931,108.0297,52.0622,25.4212,11.8458
55196942000189,"GEONIX FUNDO DE INVESTIMENTO MULTIMERCADO CRÉDITO PRIVADO","BTG WM",131.0658,105.097,51.4623,25.1283,11.7093
55315251000157,"ZSYS KREUTZER FUNDO DE INVESTIMENTO MULTIMERCADO","ZSYS",47.4425,73.2204,36.0467,17.6011,8.2018
55402464000116,"XP SINFONIA FUNDO DE INVESTIMENTO FINANCEIRO MULT CRÉDITO PRIVADO RESP LIMITADA","IAM",111.5511,115.4727,53.936,26.3362,12.2722
55502385000187,"ASA HIGH GRADE D30 CLASSE DE INVESTIMENTO RENDA FIXA CRÉDITO PRIVADO - RESP LIMITADA","ASA",105.0467,102.187,50.4331,24.6258,11.4751
55689417000103,"POLÍGONO CHARLIE PREVIDÊNCIA FUNDO DE INVESTIMENTO FINANCEIRO","Polígono",111.7678,112.6376,55.2179,26.9622,12.5638
55726312000179,"TIVIO BVP FUNDO DE INVESTIMENTO FINANCEIRO RENDA FIXA CRÉDITO PRIVADO FIFE RESPONSABILIDADE LIMITADA","Tivio",107.3001,105.1586,50.7042,24.7581,11.5368
55754091000142,"TENAX RFA PREVIDÊNCIA FIFE FUNDO DE INVESTIMENTO RENDA FIXA","Tenax",106.503,91.299,44.5333,21.745,10.1327
55763285000104,"SULAMÉRICA EXCELLENCE PLUS FIF RENDA FIXA CRÉD PRIV LONGO PRAZO DE RESP LIMITADA","Sulamérica",101.8057,102.3545,50.2802,24.5511,11.4403
55839003000105,"BNP PARIBAS FIFE CRÉDITO PREVIDENCIÁRIO FIF RENDA FIXA CRÉDITO PRIVADO RESPONSABILIDADE LIMITADA","BNP",113.8951,109.5411,53.754,26.2473,12.2307
55893460000188,"CSHG FRG FIF - CLASSE DE INVESTIMENTO MULTIMERCADO CRÉDITO PRIVADO - RESP LIMITADA","UBS",306.4097,42.7445,13.6715,6.6756,3.1107
55911526000115,"SPARTA PREVIDÊNCIA BB FIFE FI FINANCEIRO RENDA FIXA CRÉDITO PRIVADO - RESPONSABILIDADE LIMITADA","Sparta",98.2172,103.4664,50.9367,24.8717,11.5897
55928061000105,"RÉGIA EQUILÍBRIO BRASILPREV FUNDO DE INVESTIMENTO FINANCEIRO IS RENDA FIXA CRÉD PRIV - RESP LIMITADA","Regia",118.4231,113.6767,54.1255,26.4287,12.3153
55946775000146,"KADIMA YIELD FI FINANCEIRO RENDA FIXA CRÉDITO PRIVADO LONGO PRAZO RESPONSABILIDADE LIMITADA","Kadima",169.7409,100.9037,47.3913,23.1405,10.783
55994210000134,"SULAMÉRICA PREV CRÉDITO ESG FIFE ALOCAÇÃO FIF RF CRED PRIV IS RESP LIMITADA","Sulamérica",112.7468,106.4452,52.4918,25.631,11.9435
56053893000198,"SANTO AGOSTINHO FUNDO DE INVESTIMENTO MULTIMERCADO","BTG WM",184.1818,68.1421,26.189,12.7877,5.9588
56067582000188,"KINEA PREV EMPRESARIAL FUNDO DE INVESTIMENTO FINANCEIRO RENDA FIXA RESPONSABILIDADE LIMITADA","Kinea",106.3916,106.0789,51.6364,25.2133,11.7489
56108411000150,"ICATU VANGUARDA BRASILPREV ABSOLUTO PLUS FIFE FIF RF CRED PRIV - RESP LIMITADA","Icatu",133.729,114.8915,54.8064,26.7612,12.4702
56185166000184,"SANTANDER RENDA FIXA CRÉDITO PRIVADO ESG LONGO PRAZO - FIF RESP LIMITADA IS","SAM",112.1391,110.226,52.0886,25.4341,11.8518
56377520000172,"BP DSA FUNDO DE INVESTIMENTO MULTIMERCADO","BTG WM",107.5959,107.6024,53.478,26.1126,12.1679
56431727000188,"VINLAND CORE CRÉDITO III N FIFE FUNDO DE INVESTIMENTO FINANCEIRO RENDA FIXA CRÉD PRIV RESP LIMITADA","Vinland",103.9004,116.9799,58.1822,28.4095,13.2383
56545142000199,"MARTE FUNDO DE INVESTIMENTO FINANCEIRO MULTIMERCADO","Brainvest",121.9087,96.6748,42.7201,20.8596,9.7202
56608307000124,"GERDAU PREV FIF RENDA FIXA CRÉDITO PRIVADO 6 LONGO PRAZO DE RESPONSABILIDADE LIMITADA","Sulamérica",106.8093,105.8278,52.4229,25.5974,11.9279
56658377000197,"LGCY FUNDO DE INVESTIMENTO FINANCEIRO RENDA FIXA CRÉDITO PRIVADO RESPONSABILIDADE LIMITADA","Legacy",132.0729,127.0409,61.0074,29.789,13.8811
56953911000198,"JGP VÉRTICE CORPORATE III FI FINANCEIRO RENDA FIXA CRÉDITO PRIVADO - RESPONSABILIDADE LIMITADA","JGP",126.0129,114.2819,56.9672,27.8163,12.9618
56974598000174,"POLO CREDITO CORPORATIVO MASTER FI FINANCEIRO RENDA FIXA CREDITO PRIVADO LONGO PRAZO - RESP LIMITADA","Polo",178.6212,138.599,64.9124,31.6958,14.7696
