CNPJ_Fundo,Nome_Fundo,Gestor_Apelido,PctCDI_1s,PctCDI_1m,PctCDI_3m,PctCDI_6m,PctCDI_12m
00974902000129,"BOLT PREV FI FINANCEIRO MULTIMERCADO CRÉDITO PRIVADO RESPONSABILIDADE LIMITADA","BRAM",111.3292,109.7505,53.6131,26.1785,12.1987
00977449000104,"BNP PARIBAS GERDAU PREVIDÊNCIA 1 CLASSE DE INVESTIMENTO RENDA FIXA CREDITO PRIVADO RESP LIMITADA","BNP",105.2513,103.4282,50.7078,24.7599,11.5376
01361074000116,"TOP RENDA FIXA MIX CRÉD PRIV LONGO PRAZO FIF RESPONSABILIDADE LIMITADA","IAM",109.9659,114.6054,54.0498,26.3917,12.298
01380701000166,"SANTANDER PB VII MULTIMERCADO CRÉDITO PRIVADO - FUNDO DE INVESTIMENTO FINANCEIRO","San WM",217.4105,69.5973,26.1855,12.786,5.958
02224382000162,"SANTANDER  EQUILÍBRIO RENDA FIXA REF DI CRÉDITO PRIVADO - FIF RESP LIMITADA","SAM",105.6619,106.0101,51.6829,25.236,11.7595
02296928000190,"BB INSTITUCIONAL FUNDO DE INVESTIMENTO FINANCEIRO RENDA FIXA RESPONSABILIDADE LIMITADA","BB Asset",102.1112,103.2372,50.7931,24.8015,11.557
03389374000139,"BB TOP RF ARROJADO FUNDO DE INVESTIMENTO FINANCEIRO RENDA FIXA LONGO PRAZO RESPONSABILIDADE LIMITADA","BB Asset",108.1854,108.2706,53.9654,26.3506,12.2788
03960349000163,"UNIMED RV 15 FUNDO DE INVESTIMENTO FINANCEIRO MULTIMERCADO RESPONSABILIDADE LIMITADA","Vinci",202.9801,120.306,48.3854,23.6259,11.0092
04113821000195,"COLÔNIA FIF - CLASSE DE INVESTIMENTO RENDA FIXA CRÉDITO PRIVADO - RESP LIMITADA","BRAM",114.5256,104.5628,47.7523,23.3168,10.8652
04228545000100,"BRADESCO CORPORATE FI FINANCEIRO - CI RF CRED PRIV - RESP LIMITADA","BRAM",108.5897,104.5925,51.2232,25.0116,11.6549
04240128000183,"TIVIO INSTITUCIONAL 15 FIF - CI RENDA FIXA CRÉDITO PRIVADO LONGO PRAZO - RESP LIMITADA","Tivio",121.103,111.3122,54.1205,26.4263,12.3141
04501865000192,"BTG PACTUAL CAPITAL MARKETS FUNDO DE INVESTIMENTO FINANCEIRO RENDA FIXA","BTG Asset",101.2207,103.6262,51.7086,25.2486,11.7653
04587998000123,"PÉRICLES CLASSE DE INVESTIMENTO  MULTIMERCADO CRÉDITO PRIVADO - RESP LIMITADA","ASA",100.479,105.6621,51.3587,25.0777,11.6857
04618345000164,"ALBATROZ FIF - CLASSE DE INVESTIMENTO MULTIMERCADO CRÉDITO PRIVADO - RESP LIMITADA","JGP",137.0587,114.1248,61.5005,30.0298,13.9933
04621721000170,"XP CORPORATE TOP CRÉDITO PRIVADO FI FINANCEIRO EM RENDA FIXA LONGO PRAZO - RESPONSABILIDADE LIMITADA","XPG",125.2179,114.6738,57.2307,27.9449,13.0218
04764252000148,"MONT BLANC PREVIDENCIÁRIO FUNDO DE INVESTIMENTO FINANCEIRO RENDA FIXA","BNP",94.6387,106.9971,52.1055,25.4424,11.8557
04875006000163,"BRAM IQ FIF - CLASSE DE INVESTIMENTO RENDA FIXA CRÉDITO PRIVADO - RESPONSABILIDADE LIMITADA","BRAM",107.8987,105.4095,51.7058,25.2472,11.7647
04885571000101,"CEARÁ FIF  - CLASSE DE INVESTIMENTO RF  CRÉDITO PRIVADO - RESP  LTDA","Icatu",268.3374,145.3126,53.5657,26.1554,12.1879
04899128000190,"SULAMÉRICA EXCELLENCE FIF RENDA FIXA CRÉDITO PRIVADO DE RESPONSABILIDADE LIMITADA","Sulamérica",104.4681,102.8123,50.5209,24.6687,11.4951
05018037000160,"BRASILSEG RENDA FIXA CRÉDITO PRIVADO FUNDO DE INVESTIMENTO FINANCEIRO RESPONSABILIDADE LIMITADA","BB Asset",103.9389,106.5846,52.3238,25.549,11.9053
05108379000171,"CITRINO I - FIF CLASSE DE INVESTIMENTO RENDA FIXA CRÉDITO PRIVADO RESPONSABILIDADE LIMITADA","Safra Asset",99.9257,102.0268,49.8933,24.3622,11.3523
05508422000196,"EQTPREV STRATEGY FIF MULTIMERCADO CRÉDITO PRIVADO DE RESPONSABILIDADE LIMITADA","Sulamérica",109.8363,106.1858,52.6367,25.7018,11.9765
05615511000131,"MBPREV I FUNDO DE INVESTIMENTO FINANCEIRO RENDA FIXA RESPONSABILIDADE LIMITADA","BRAM",102.8162,101.1037,48.7465,23.8023,11.0914
05615522000111,"MBPREV II FUNDO DE INVESTIMENTO FINANCEIRO MULTIMERCADO RESPONSABILIDADE LIMITADA","BRAM",107.6759,100.1661,47.9772,23.4266,10.9163
05832360000173,"BB ATACADO MISTO FUNDO DE INVESTIMENTO FINANCEIRO RENDA FIXA LONGO PRAZO CRÉDITO PRIVADO RESP LIM","BB Asset",110.1837,109.966,53.0294,25.8935,12.0659
05922462000180,"UBS CONSENSO PÓS FIXADO FIF DE RENDA FIXA CRÉDITO PRIVADO RESPONSABILIDADE LIMITADA","UBS",99.8891,102.657,50.754,24.7824,11.5481
06015421000172,"BB TOP CRÉDITO PRIVADO ASG FIF RENDA FIXA INVESTIMENTO SUSTENTÁVEL LONGO PRAZO RESP LIMITADA","BB Asset",106.3586,110.5911,54.8679,26.7912,12.4842
06066907000130,"ITAÚ RENDA FIXA CRED PRIV MASTER ACTIVE FIX FIF RESPONSABILIDADE LIMITADA","IAM",105.3457,111.7103,53.1838,25.9689,12.101
06077638000107,"BRADESCO FIF - CLASSE DE INVESTIMENTO RF CRÉDITO PRIVADO LP PERFORMANCE - RESP LIMITADA","BRAM",107.9751,104.7287,51.2617,25.0304,11.6637
06086684000172,"RAMA FI FINANCEIRO - CI MULT CRED PRIV - RESP LIMITADA","Rafter",108.7363,108.4667,53.2536,26.003,12.1169
06866051000187,"TIVIO INSTITUCIONAL RENDA FIXA CRED PRIV FUNDO DE INVESTIMENTO FINANCEIRO - RESP LIMITADA","Tivio",107.6421,104.0795,50.1483,24.4867,11.4103
07593967000173,"BRASILPREV TOP TP FUNDO DE INVESTIMENTO FINANCEIRO RENDA FIXA CRÉDITO PRIVADO RESP LIMITADA","BB Asset",110.8246,109.2604,52.3163,25.5453,11.9036
07889704000106,"WESTERN ASSET INCOME GENERATION ICATU PREV RENDA FIXA FIF CRED PRIV RESP LIMITADA","Franklin Templeton",98.7439,98.2881,47.999,23.4373,10.9213
07900255000150,"ICATU VANGUARDA CRÉDITO PRIVADO FIF - CLASSE DE INVESTIMENTO RENDA FIXA LP -RESP LIMITADA","Icatu",146.2855,128.1358,62.0188,30.2829,14.1112
08252580000116,"ASPECIR PGBL FUNDO DE INVESTIMENTO RENDA FIXA CRÉDITO PRIVADO PREVIDENCIÁRIO - RESPONSABILIDADE LIMI","4UM",120.2281,107.7672,53.1381,25.9466,12.0906
08608370000118,"SABESPREV CRÉDITO PRIVADO PPM FUNDO DE INVESTIMENTO FINANCEIRO RENDA FIXA RESPONSABILIDADE LIMITADA","BRZ",95.3143,90.9851,46.5368,22.7233,10.5886
08708502000183,"ASA ESTRATÉGIA FUNDO DE INVESTIMENTO FINANCEIRO EM COTAS DE FUNDOS DE INVESTIMENTO RENDA FIXA","ASA",96.8876,99.8898,49.0182,23.9349,11.1532
08868449000188,"RHODES CLASSE DE INVESTIMENTO MULTIMERCADO CRÉDITO PRIVADO - RESP LIMITADA","ASA",161.8836,115.5575,44.563,21.7595,10.1395
08960978000107,"BANRISUL FLEX CREDITO PRIVADO FUNDO DE INVESTIMENTO RENDA FIXA DE LONGO PRAZO RESPONS LIMITADA","Banrisul",109.7497,107.3181,53.0248,25.8913,12.0648
08984821000111,"BIOESTRATÉGIA FI FINANCEIRO - CI MULT CRED PRIV - RESP LIMITADA","Rafter",111.5377,110.96,53.9304,26.3335,12.2709
09083848000104,"TIVIO LEGACY PREVIDÊNCIA FIF - CLASSE DE INVESTIMENTO RENDA FIXA CRED PRIV - RESP LIMITADA","Tivio",108.8139,107.0121,52.2718,25.5236,11.8935
09087708000104,"WESTERN ASSET PREV CREDIT RENDA FIXA CRÉDITO PRIVADO FUNDO DE INVESTIMENTO FINANCEIRO RESP LIMITADA","Franklin Templeton",101.5761,103.8295,50.3335,24.5772,11.4525
09087799000170,"BALTIMORE FUNDO DE INVESTIMENTO FINANCEIRO MULTIMERCADO CRÉDITO PRIVADO RESPONSABILIDADE LIMITADA","Franklin Templeton",184.6011,98.7997,39.3262,19.2024,8.948
09136668000135,"SAFRA CAPITAL MARKET FIF CLASSE DE INVESTIMENTO RENDA FIXA CRÉDITO PRIVADO RESPONSABILIDADE LIMITADA","Safra Asset",99.3139,99.9304,48.9494,23.9013,11.1376
09181291000136,"XCVI FUNDO DE INVESTIMENTO FINANCEIRO MULTIMERCADO CRÉDITO PRIVADO - RESPONSABILIDADE LIMITADA","XPG",101.2767,99.4643,41.3847,20.2128,9.4226
09329721000114,"UBS EVOLUTION DI MASTER FUNDO DE INVESTIMENTO FINANCEIRO RENDA FIXA REFERENCIADO RESP LIMITADA","UBS",101.4084,102.7802,50.6526,24.7329,11.5251
09543255000175,"RIO BRAVO FI FINANCEIRO - CI RF CRED PRIV - RESP LIMITADA","Rio Bravo",110.9758,74.511,41.4732,20.2508,9.4365
09577500000165,"SANTANDER CRESCIMENTO RF CRÉD PRIV LONGO PRAZO - FIF RESP LIMITADA","SAM",123.7013,115.5954,55.5804,27.1391,12.6463
09720710000160,"INTER CONSERVADOR PLUS FIF RENDA FIXA CRÉDITO PRIVADO LONGO PRAZO RESP LIMITADA","Inter",98.9229,99.7406,49.5722,24.2054,11.2792
09720734000110,"AF INVEST GERAES FUNDO DE INVESTIMENTO FINANCEIRO RENDA FIXA","AF Invest",117.8933,109.4551,52.6751,25.7205,11.9853
10264255000115,"ITAÚ RENDA FIXA CRÉDITO PRIVADO DIFERENCIADO FIF RESP LIMITADA","IAM",102.1709,106.1348,51.8926,25.3384,11.8072
10322668000109,"CAIXA FIDELIDADE II FUNDO DE INVESTIMENTO FINANCEIRO RENDA FIXA CRÉDITO PRIVADO LP - RESP LIMITADA","CEF Asset",100.9085,103.0006,50.7181,24.765,11.54
10326625000100,"VALORA ABSOLUTE FIF RENDA FIXA CRÉD PRIV LONGO PRAZO - RESPONSABILIDADE LIMITADA","Valora",110.0386,109.2639,56.0358,27.3615,12.7499
10347228000106,"SAFRA REFERENCIADO FIF CLASSE DE INVEST RENDA FIXA REFERENCIADA DI CRÉDITO PRIVADO RESP LIMITADA","Safra Asset",102.8816,101.731,49.7204,24.2778,11.313
10551353000133,"CAIXA QUALIFICADO FUNDO DE INVESTIMENTO FINANCEIRO RENDA FIXA CRÉDITO PRIVADO LP - RESP LIMITADA","CEF Asset",99.0155,101.2542,50.1002,24.4632,11.3994
10813716000161,"BRADESCO H PERFORMANCE INSTITUCIONAL FI FINANCEIRO - CI RF CRED PRIV LP - RESP LIMITADA","BRAM",112.0445,106.5031,51.7793,25.2831,11.7814
10948577000183,"CAIXA MASTER FUNDO DE INVESTIMENTO FINANCEIRO RENDA FIXA CRÉDITO PRIVADO LONGO PRAZO - RESP LIMITADA","CEF Asset",102.1528,104.3292,51.6904,25.2397,11.7612
11039158000191,"DAKAR FI FINANCEIRO - CI MULT CRED PRIV - RESP LIMITADA","Aramus",121.8993,113.9829,53.0575,25.9072,12.0723
11121992000121,"BNP PARIBAS FI FINANCEIRO ZAFIRA RENDA FIXA CRÉDITO PRIVADO PREVIDENCIÁRIO RESP LTDA","BNP",115.7334,114.4257,55.2976,27.001,12.5819
11225793000163,"FÊNIX FUNDOS DE INVESTIMENTO MULTIMERCADO","Lifetime",147.8724,106.395,50.2388,24.5309,11.4309
11248452000103,"NESTON FIF - CLASSE DE INVESTIMENTO RENDA FIXA CRÉDITO PRIVADO LP - RESPONSABILIDADE LIMITADA","JGP",120.7827,110.754,57.874,28.2591,13.1682
11435262000103,"PIRAHY FUNDO DE INVESTIMENTO FINANCEIRO MULTIMERCADO","BTG WM",108.9263,30.6099,13.417,6.5514,3.0528
11435287000107,"MAG FUNDO DE INVESTIMENTO FINANCEIRO - CLASSE DE  INVESTIMENTO RENDA FIXA - RESP LIMITADATA","MAG",109.6099,103.3075,48.9927,23.9224,11.1474
11447056000105,"LINCOLN FUNDO DE INVESTIMENTO FINANCEIRO MULTIMERCADO CRÉDITO PRIVADO RESPONSABILIDADE LIMITADA","Portofino",94.7631,95.4289,47.0388,22.9684,10.7028
11447124000136,"SAFRA VITESSE FIF CLASSE DE INVESTIMENTO RENDA FIXA CRÉDITO PRIVADO RESPONSABILIDADE LIMITADA","Safra Asset",99.5652,100.0682,48.932,23.8928,11.1336
11447136000160,"PRINCIPAL CLARITAS FUNDO DE INVESTIMENTO FINANCEIRO RENDA FIXA","Principal",116.1547,111.3295,54.9835,26.8477,12.5105
11508507000177,"SOLIS VEGA FUNDO DE INVESTIMENTO FINANCEIRO RENDA FIXA","Solis",106.741,110.1153,54.2467,26.4879,12.3428
11555338000126,"BRADESCO EMPRESAS H FIF - CLASSE DE INVESTIMENTO RF CRED PRIVADO LP PERFORMANCE 20 - RESP LIMITADA","BRAM",109.7844,105.5156,51.2574,25.0283,11.6627
11839215000117,"BB RF CRÉDITO PRIVADO LONGO PRAZO DEDICADO ANS FUNDO DE INVESTIMENTO FINANCEIRO RESP LIMITADA","BB Asset",105.9303,109.1902,54.305,26.5164,12.3561
11961080000168,"MAG PREVIDÊNCIA CRÉDITO PRIVADO FIF - CLASSE DE INVESTIMENTO RF  - RESP  LIMITADA","MAG",126.0602,108.9397,58.5278,28.5783,13.3169
11961206000102,"RHODES FUNDO DE INVESTIMENTO FINANCEIRO MULTIMERCADO CRÉDITO PRIVADO RESPONSABILIDADE LIMITADA","XPG",109.6619,108.2409,53.0829,25.9196,12.078
12059831000118,"DHF-M FUNDO DE INVESTIMENTO FINANCEIRO","Dynamo",729.0983,-74.1449,-77.4708,-37.8279,-17.6271
12412818000109,"BRAM LIVRE FI FINANCEIRO - CI RF CRED PRIV - RESP LIMITADA","BRAM",112.828,110.8727,54.6127,26.6666,12.4261
12698632000150,"MARATHON FUNDO DE INVESTIMENTO MULTIMERCADO","Prumo",186.6424,67.4524,24.0457,11.7412,5.4712
12796193000118,"SAFRA PREV VITESSE ICATU FIF PREV CI RF CRÉDITO PRIVADO PREVIDENCIÁRIO RESPONSABILIDADE LIMITADA","Safra Asset",97.9539,99.4495,47.2976,23.0947,10.7617
13058736000162,"CAIXA PREVINVEST PREVIDENCIÁRIO FIF RENDA FIXA CRÉDITO PRIVADO - RESPONSABILIDADE LIMITADA","CEF Asset",104.7917,104.005,51.4357,25.1153,11.7032
13106998000155,"CAPITANIA FIX CREDITO PRIVADO FI FINANCEIRO RENDA FIXA - RESPONSABILIDADE LIMITADA","Capitânia",129.012,20.604,22.8966,11.1801,5.2097
13400194000164,"BRAM CAPITAL FI FINANCEIRO - CI RF CRED PRIV - RESP LIMITADA","BRAM",106.5939,105.4732,51.6155,25.2031,11.7442
13411914000197,"ITAÚ FLEXPREV PRIVATE FUNDO DE INVESTIMENTO FINANCEIRO RENDA FIXA CRÉDITO PRIVADO - RESP LIMITADA","IAM",106.3186,107.5214,51.9647,25.3736,11.8236
13455189000159,"SANTANDER ANS RENDA FIXA CRÉDITO PRIVADO - FIF RESP LIMITADA","SAM",104.7452,104.1889,50.7023,24.7572,11.5364
13492738000165,"DAYCOVAL CLASSIC PREVIDÊNCIA FUNDO DE INVESTIMENTO FINANCEIRO","Daycoval",101.1618,104.8858,51.512,25.1526,11.7206
13596496000150,"PALMARES CLASSE DE INVESTIMENTO MULTIMERCADO CRÉDITO PRIVADO","Brainvest",126.28,87.9809,40.9156,19.9785,9.3096
13823084000105,"SUL AMÉRICA CRÉDITO ATIVO FIF RENDA FIXA CRÉD PRIV LONGO PRAZO DE RESP LIMITADA","Sulamérica",110.0257,104.5431,52.1192,25.4491,11.8588
13935899000186,"FUNDO DE INVESTIMENTO FINANCEIRO MULTIMERCADO VEGA","BTG WM",403.352,62.7239,17.2932,8.444,3.9348
14146491000198,"XP INFLAÇÃO FUNDO DE INVESTIMENTO EM RENDA FIXA LONGO PRAZO RESPONSABILIDADE LIMITADA","XPG",213.4387,103.4558,37.3373,18.2313,8.4954
14158932000171,"FUNDO DE INVESTIMENTO MULTIMERCADO FRATELLI LONGO PRAZO","Scalare",507.2807,15.9301,-12.1184,-5.9172,-2.7573
14188164000107,"SPARTA TOP MASTER CRÉDITO PRIVADO FIF RENDA FIXA LONGO PRAZO - RESPONSABILIDADE LIMITADA","Sparta",96.7892,108.5409,53.8676,26.3028,12.2566
14399722000175,"GERDAU 4 PREVIDÊNCIA FIF RENDA FIXA CRÉDITO PRIVADO - RESPONSABILIDADE LIMITADA","XPG",107.5263,106.2256,51.9624,25.3725,11.8231
14399804000110,"GERDAU PREVIDÊNCIA 3 FIF - CLASSE DE INVESTIMENTO RF CRÉDITO PRIVADO - RESP LIMITADA","Icatu",107.1751,105.5244,51.0097,24.9073,11.6063
14466898000100,"BRASIL CORPORATE FIF RENDA FIXA CRÉDITO PRIVADO LONGO PRAZO - RESPONSABILIDADE LIMITADA","Plural",107.01,110.2951,53.7902,26.265,12.239
14473842000175,"UBS ROKA FUNDO DE INVESTIMENTO FINANCEIRO - MULTIMERCADO CRÉDITO PRIVADO RESPONSABILIDADE LIMITADA","UBS",0,211.5018,73.3766,35.8334,16.701
14491665000150,"TIVIO FI FINANCEIRO - CI RF CRED PRIV - RESP LIMITADA","Tivio",118.2416,112.4646,57.5628,28.1071,13.0974
14557317000138,"BTG PACTUAL CREDITO CORPORATIVO FUNDO DE INVESTIMENTO FINANCEIRO RENDA FIXA","BTG Asset",117.0551,114.4538,54.6789,26.6989,12.4412
15174629000125,"INTEGRAL FUNDO DE INVESTIMENTO FINANCEIRO RENDA FIXA","Integral",108.2935,116.4971,59.2639,28.9377,13.4844
15207219000133,"CONFIANCE MULTISTRATEGIES FUNDO DE INVESTIMENTO MULTIMERCADO - CRÉDITO PRIVADO","Capri",116.3034,87.6382,42.3019,20.6581,9.6282
15259169000138,"WESTERN ASSET GROWTH FIF RENDA FIXA CRÉDITO PRIVADO RESPONSABILIDADE LIMITADA","Franklin Templeton",105.3955,106.1226,50.2278,24.5255,11.4284
15350679000116,"PLURAL HIGH GRADE FIF RENDA FIXA CRÉDITO PRIVADO - RESPONSABILIDADE LIMITADA","Plural",102.3367,103.4207,50.3234,24.5722,11.4502
15487311000102,"PLURAL CRÉDITO CORPORATIVO FIF RENDA FIXA CRÉDITO PRIVADO LP - RESPONSABILIDADE LIMITADA","Plural",106.0066,108.4895,53.3766,26.063,12.1449
15612416000138,"CAPITANIA ALFA FIF - CLASSE DE INVESTIMENTO RENDA FIXA CRÉDITO PRIVADO - RESPONSABILIDADE LIMITADA","Capitânia",59.042,110.8644,57.4077,28.0314,13.0621
15675437000100,"BRAM FI FINANCEIRO - CI RF CRED PRIV - RESP LIMITADA","BRAM",113.8323,108.0615,52.35,25.5618,11.9113
16599959000125,"TAGUS TOP II FUNDO DE INVESTIMENTO FINANCEIRO RENDA FIXA","Tagus",157.8729,125.4131,60.7406,29.6588,13.8204
16916048000184,"CATEDRAL FUNDO DE INVESTIMENTO FINANCEIRO RENDA FIXA CRÉDITO PRIVADO - RESPONSABILIDADE LIMITADA","Funcef",351.4696,173.1117,59.5632,29.0839,13.5525
17041023000147,"HARPIA CRED PRIV FI FINANCEIRO - CI RF CRED PRIV - RESP LIMITADA","Capitânia",78.3201,119.0496,61.1712,29.869,13.9184
17051205000107,"ITAÚ INSTITUCIONAL RENDA FIXA ACTIVE FIX CRÉDITO PRIVADO MASTER FIF RESPONSABILIDADE LIMITADA","IAM",109.8298,111.8212,52.7261,25.7454,11.9969
17072894000128,"SABESPREV FUNDO DE INVESTIMENTO FINANCEIRO MULTIMERCADO CRÉDITO PRIVADO RESPONSABILIDADE LIMITADA","Polo",167.0889,136.879,43.06,21.0283,9.8008
17138011000135,"UNIMED FUNDO DE INVESTIMENTO FINANCEIRO RENDA FIXA CRÉDITO PRIVADO PREVIDENCIÁRIO RESP LIMITADA","BNP",109.5731,104.4237,51.147,24.9744,11.6376
17138466000150,"SANTANDER ANS II RENDA FIXA CRÉDITO PRIVADO - FIF RESP LIMITADA","SAM",103.6525,103.1065,50.6853,24.7489,11.5325
17138474000105,"SANTANDER CRESCIMENTO INSTITUCIONAL RENDA FIXA CRÉDITO PRIVADO LONGO PRAZO - FIF RESP LIMITADA","SAM",118.632,110.3162,54.1966,26.4634,12.3314
17225793000140,"BB ECO PLUS FUNDO DE INVESTIMENTO FINANCEIRO RENDA FIXA CRÉDITO PRIVADO RESPONSABILIDADE LIMITADA","BB Asset",97.5337,103.2849,51.5669,25.1794,11.7331
17329754000192,"BNP PARIBAS CAMARO FIF RENDA FIXA PREVIDENCIÁRIO CRÉDITO PRIVADO - RESPONSABILIDADE LIMITADA","BNP",109.2024,110.8242,53.9542,26.3451,12.2763
17329785000143,"ÂMBAR PREVIDENCIÁRIO MULTIMERCADO CRÉDITO PRIVADO FUNDO DE INVESTIMENTO FINANCEIRO RESP LIMITADA","Portofino",153.9289,66.8375,29.1843,14.2503,6.6403
17339084000195,"WESTERN ASSET TROPICAL FI FINANCEIRO - CI RF - RESP LIMITADA","Franklin Templeton",119.6861,107.5938,49.3983,24.1205,11.2397
17689994000106,"BNP PARIBAS IGUAÇU CLASSE DE INVESTIMENTO MULTIMERCADO CRÉDITO PRIVADO - RESPONSABILIDADE LIMITADA","BNP",132.4701,130.2298,57.8332,28.2391,13.1589
17898668000109,"AQUILA 6 CRÉDITO PRIVADO FUNDO DE INVESTIMENTO FINANCEIRO RENDA FIXA - RESPONSABILIDADE LIMITADA","Capitânia",88.6711,103.3758,59.9277,29.2619,13.6355
17913386000125,"FUNDO DE INVESTIMENTO FINANCEIRO MULTIMERCADO GIDU INVEST NO EXTERIOR CRÉD PRIV - RESP LIMITADA","BTG WM",202.2663,99.1932,4.7283,2.3088,1.0758
18428655000120,"BB TOP RENDA FIXA CREDITO PRIVADO ALTO RENDIMENTO LONGO PRAZO FIF RESPONSABILIDADE LIMITADA","BB Asset",138.0042,117.3039,60.9997,29.7853,13.8794
18599004000101,"SANTANDER PREV CRESCIMENTO RENDA FIXA CRÉDITO PRIVADO - FIF RESP LIMITADA","SAM",113.578,109.3173,51.9102,25.347,11.8112
18719154000101,"PORTO SEGURO FUNDO DE INVESTIMENTO FINANCEIRO RENDA FIXA REFERENCIADO DI CRED PRIV RESP LIMITADA","Porto Asset",102.8465,103.8804,49.9868,24.4079,11.3736
18814964000139,"XP HORIZONTE PREV MASTER FUNDO DE INVESTIMENTO FINANCEIRO RENDA FIXA - RESPONSABILIDADE LIMITADA","XPG",144.7328,105.692,48.4164,23.6411,11.0163
18816175000137,"RAFTER FI FINANCEIRO - CI RF CRED PRIV - RESP LIMITADA","Rafter",104.5197,103.4822,50.8015,24.8056,11.5589
18990334000115,"JGP CORPORATE PLUS MASTER FUNDO DE INVESTIMENTO FINANCEIRO MULTIMERCADO CRÉDITO PRIVADO RESP LTDA","JGP",118.4316,113.5086,58.9945,28.8062,13.4231
19390898000180,"SAFRA PREV CAPITAL MARKET FIF PREVIDENCIÁRIO CI RENDA FIXA CRÉDITO PRIVADO PREV RESP LIMITADA","Safra Asset",100.5878,102.641,50.3694,24.5947,11.4606
19413568000162,"UPSALA FIF - CLASSE DE INVESTIMENTO MULTIMERCADO CRÉDITO PRIVADO - RESP LIMITADA","Prada",114.3422,102.5912,47.6128,23.2487,10.8334
19436722000111,"BRASIL ASSET FI FINANCEIRO EM RENDA FIXA CRÉDITO PRIVADO - RESPONSABILIDADE LIMITADA","XPG",105.5521,106.0525,51.8253,25.3056,11.7919
19436808000144,"DEZOITO FIF CLASSE DE INVESTIMENTO RENDA FIXA CRÉDITO PRIVADO RESPONSABILIDADE LIMITADA","Safra Asset",101.7096,100.3607,49.3773,24.1102,11.2349
19531929000175,"BANESES FUNDO DE INVESTIMENTO  FINANCEIRO RENDA FIXA CRÉDITO PRIVADO - RESPONSABILIDADE LIMITADA","BRZ",180.6142,84.845,40.9502,19.9954,9.3175
19550100000110,"SANTANDER FLEXÍVEL RF CRÉD PRIV - FIF RESP LIMITADA","SAM",124.1664,110.1972,51.964,25.3733,11.8235
19719719000105,"PREVICOKE FIF - CLASSE DE INVESTIMENTO RENDA FIXA CRÉDITO PRIVADO - RESP LIMITADA","JGP",124.1056,111.9846,57.0371,27.8504,12.9778
19719727000151,"ICATU VANGUARDA INFLAÇÃO FIF - CI RENDA FIXA CRÉD PRIV LONGO PRAZO - RESP LIMITADA","Icatu",257.4229,112.7336,40.0886,19.5747,9.1214
19782311000188,"AZ QUEST VALORE FUNDO DE INVESTIMENTO FINANCEIRO RENDA FIXA CRÉDITO PRIVADO","AZ Quest",128.9108,108.2985,51.0353,24.9198,11.6122
19831152000164,"BPC POLIURETANO FIF - CLASSE DE INVESTIMENTO MULTIMERCADO - RESP LIMITADA","Franklin Templeton",121.0683,111.2805,49.7459,24.2902,11.3188
19941689000187,"JACARANDÁ FUNDO DE INVESTIMENTO FINANCEIRO MULTIMERCADO CRÉDITO PRIVADO RESPONSABILIDADE LIMITADA","IAM",275.9371,80.0118,22.4514,10.9627,5.1084
19941929000143,"ZANIAH FUNDO DE INVESTIMENTO FINANCEIRO MULTIMERCADO CRÉDITO PRIVADO RESPONSABILIDADE LIMITADA","BNP",102.7351,104.0089,51.1248,24.9635,11.6325
19959517000130,"SULAMÉRICA PRESTIGE STRATEGIE FIFE FIF RENDA FIXA CRÉDITO PRIVADO RESPONSABILIDADE LIMITADA","Sulamérica",105.8657,104.8749,51.5185,25.1558,11.7221
20146318000192,"CAPITANIA PREMIUM MASTER FIF RENDA FIXA CRÉDITO PRIVADO LONGO PRAZO - RESPONSABILIDADE LIMITADA","Capitânia",85.5378,-33.0682,7.4719,3.6484,1.7001
20155921000130,"METLIFE FUNDO DE INVESTIMENTO FINANCEIRO RENDA FIXA II RESPONSABILIDADE LIMITADA","Franklin Templeton",111.2107,106.034,50.4422,24.6302,11.4772
20231879000190,"RAFTER MODERADO FI FINANCEIRO - CI MULT CRED PRIV - RESP LIMITADA","Rafter",247.2438,92.636,43.3898,21.1866,9.8725
20519417000172,"AZIMUT CORUJA FI FINANCEIRO - CI RF CRED PRIV - RESP LIMITADA","AZ Quest",120.4326,107.0498,51.259,25.0291,11.6631
20833920000106,"JGP CORPORATE MASTER FIF RENDA FIXA CRÉDITO PRIVADO LONGO PRAZO - RESPONSABILIDADE LIMITADA","JGP",122.6646,114.7531,57.5838,28.1173,13.1021
20833940000179,"MAG OABPREV GO FUNDO DE  INVESTIMENTO FINANCEIRO MULTIMERCADO  RESPONSABILIDADE LIMITADA","MAG",114.9708,123.9621,48.6858,23.7726,11.0776
20879578000177,"INTER CONSERVADOR FUNDO DE INVESTIMENTO FINANCEIRO RENDA FIXA CRÉDITO PRIVADO RESP LIMITADA","Inter",101.4281,97.9973,50.8219,24.8156,11.5636
20887247000189,"GERDAU PREVIDÊNCIA FUNDO DE INVESTIMENTO RENDA FIXA CRÉDITO PRIVADO 5","Plural",104.2249,105.3693,51.3405,25.0688,11.6816
21040600000153,"BTG MULTIGESTOR CREDIT FIF - CLASSE DE INVESTIMENTO MULTIMERCADO CRED PRIV - RESP ILIMITADA","BTG WM",110.1701,112.6416,56.9708,27.8181,12.9627
21321600000121,"BRADESCO BRFPREV FIF CLASSE DE INVESTIMENTO RENDA FIXA CRÉDITO PRIVADO - RESPONSABILIDADE LIMITADA","BRAM",210.8753,112.4377,35.5895,17.3779,8.0977
21336440000194,"BTG PACTUAL CRÉDITO CORPORATIVO PREVIDÊNCIA FUNDO DE INVESTIMENTO FINANCEIRO MULTIMERCADO","BTG Asset",128.2225,117.4854,54.3082,26.518,12.3569
21596021000191,"CALEDÔNIA CLASSE DE INVESTIMENTO RENDA  FIXA CRÉDITO PRIVADO - RESPONSABILIDADE  LIMITADA","BTG WM",59.18,97.511,50.0074,24.4179,11.3783
21613158000107,"FO FUNDO DE INVESTIMENTO FINANCEIRO RENDA FIXA","BTG WM",116.0244,106.8958,52.9808,25.8698,12.0548
21762085000115,"JGP SELECT MASTER FUNDO DE INVESTIMENTO FINANCEIRO MULTIMERCADO CRÉDITO PRIVADO RESP LTDA","JGP",110.8144,110.1512,60.5752,29.578,13.7828
21791224000139,"DESTERRO FIF RENDA FIXA CRÉDITO PRIVADO - RESP LIMITADA","BRZ",189.7033,141.7122,63.6013,31.0556,14.4713
21888723000149,"ITAÚ RENDA FIXA CRÉDITO PRIVADO DIFERENCIADO II FUNDO DE INVESTIMENTO FINANCEIRO RESP LIMITADA","IAM",103.6318,106.7831,52.2847,25.5299,11.8964
22003346000186,"DEVANT SOLIDUS CASH FUNDO DE INVESTIMENTO FINANCEIRO","Devant",114.2201,124.8786,41.049,20.0436,9.3399
22041150000186,"BRASIL PLURAL MASTER PREVIDÊNCIA CRÉDITO PRIVADO FIF RENDA FIXA - RESPONSABILIDADE LIMITADA","Plural",106.8266,107.8964,52.811,25.7869,12.0162
22118303000146,"CW1 CRÉDITO PRIVADO FUNDO DE INVESTIMENTO FINANCEIRO MULTIMERCADO - RESPONSABILIDADE LIMITADA","Capitânia",124.942,44.3765,29.1157,14.2168,6.6247
22232878000195,"BTG PACTUAL ANS RF FUNDO DE INVESTIMENTO FINANCEIRO RENDA FIXA","BTG Asset",141.4388,121.0005,59.6314,29.1172,13.568
22985070000189,"XPCE RF FUNDO DE INVESTIMENTO FINANCEIRO MULTIMERCADO CRÉDITO  PRIVADO - RESPONSABILIDADE LIMITADA","XPG",105.0123,110.8751,49.3653,24.1044,11.2322
23225888000166,"BUTIÁ TOP CRÉDITO PRIVADO FUNDO DE INVESTIMENTO RENDA FIXA MASTER","Butiá",111.5574,109.0025,53.9001,26.3187,12.264
23272391000107,"CAPITÂNIA RADAR 90 FIF MULTIMERCADO CRÉDITO PRIVADO LONGO PRAZO - RESPONSABILIDADE LIMITADA","Capitânia",-102.9376,-123.8845,-14.3043,-6.9846,-3.2547
23376623000169,"POLO HIGH YIELD MASTER CRÉDITO PRIVADO FIF MULTIMERCADO - RESPONSABILIDADE LIMITADA","Polo",166.1745,129.7801,59.1722,28.8929,13.4636
23502713000159,"SUL AMÉRICA PLURAL MASTER PREV FIFE FIF RENDA FIXA CRÉDITO PRIVADO DE RESPONSABILIDADE LIMITADA","Plural",106.9151,107.1512,52.6553,25.7108,11.9808
23556180000198,"AZ QUEST ALTRO MASTER FUNDO DE INVESTIMENTO FINANCEIRO MULTIMERCADO CRÉDITO PRIVADO","AZ Quest",133.1421,112.8633,54.1389,26.4353,12.3183
23556204000109,"AZ QUEST LUCE MASTER FIF RENDA FIXA CRÉDITO PRIVADO LONGO PRAZO - RESPONSABILIDADE LIMITADA","AZ Quest",124.391,115.8527,55.0561,26.8831,12.527
23738226000190,"AZ QUEST ICATU MASTER FIFE CONSERVADOR FIF RENDA FIXA PREVIDENCIÁRIO CRÉD PRIV - RESP LTDA","AZ Quest",128.9744,113.3782,54.279,26.5037,12.3502
23748539000129,"SULAMÉRICA FUNDO DE INVESTIMENTO FINANCEIRO RENDA FIXA ANS CRÉDITO PRIVADO DE RESP LIMITADA","Sulamérica",106.5743,103.8228,50.754,24.7825,11.5481
23781888000142,"1622 FUNDO DE INVESTIMENTO FINANCEIRO MULTIMERCADO","BTG WM",127.6364,107.2923,49.7265,24.2807,11.3144
24068085000108,"TB HIGH YIELD FUNDO DE INVESTIMENTO FINANCEIRO MULTIMERCADO LONGO PRAZO","TAG",94.4791,113.8006,56.4109,27.5447,12.8353
24215239000147,"JGP QP5 FUNDO DE INVESTIMENTO FINANCEIRO MULTIMERCADO LIVRE CRÉDITO PRIVADO RESP LIMITADA","JGP",126.5647,114.6283,56.7702,27.7201,12.917
24215307000178,"QUANTITA QP3 FUNDO DE INVESTIMENTO FINANCEIRO MULTIMERCADO LIVRE CRÉDITO PRIVADO RESP LIMITADA","Quantitas",109.8962,111.0116,51.9641,25.3734,11.8235
24444154000130,"SPARTA MAX MASTER FIF RENDA FIXA CRÉDITO PRIVADO LONGO PRAZO - RESPONSABILIDADE LIMITADA","Sparta",96.6069,111.4401,54.7078,26.7131,12.4478
24572511000146,"GALT FI FINANCEIRO RENDA FIXA CRÉDITO PRIVADO LONGO PRAZO - RESPONSABILIDADE LIMITADA","Galt",106.3154,102.2432,51.5922,25.1917,11.7389
24986620000100,"POLO MULTISETORIAL III CLASSE DE INVESTIMENTO MULTIMERCADO CRÉDITO PRIVADO - RESP LIMITADA","Polo",164.2597,132.9683,64.3997,31.4455,14.653
25079461000122,"SAFRA ANS VITESSE FIF CLASSE DE INVESTIMENTO RENDA FIXA CRÉDITO PRIVADO RESPONSABILIDADE LIMITADA","Safra Asset",98.0466,100.0423,48.9983,23.9252,11.1487
