40156669000191,"ALFAPREV SIRIUS FIF PREVIDENCIÁRIO CLASSE DE INV RENDA FIXA CRÉDITO PRIVADO PREV RESP LIMITADA","Safra Asset",429.3068,86.4794,48.2985,23.5835,10.9894
40194274000183,"CAIXA MASTER PLUS QUALIFICADO FIF RENDA FIXA CRÉDITO PRIVADO LONGO PRAZO - RESPONSABILIDADE LIMITADA","CEF Asset",102.2859,107.0383,53.6963,26.2192,12.2176
40194279000106,"CAIXA MASTER PLUS FUNDO DE INVESTIMENTO FINANCEIRO RENDA FIXA CRÉDITO PRIVADO LP - RESP LIMITADA","CEF Asset",102.1493,107.8917,54.4792,26.6014,12.3957
40219186000199,"ARROW 2 PREVIDÊNCIA FUNDO DE INVESTIMENTO FINANCEIRO MULTIMERCADO","Ekho",87.7221,82.6477,40.0208,19.5416,9.106
40413612000120,"BRADESCO TITÂNIO INFLAÇÃO FI FINANCEIRO - CI RF CRED PRIV - RESP LIMITADA","BRAM",166.1813,98.5249,41.9336,20.4756,9.5412
40456260000190,"VALORA MASTER FIFE PREVIDENCIÁRIO FUNDO DE INVESTIMENTO RENDA FIXA CRÉDITO PRIVADO","Valora",102.2295,106.6541,50.1679,24.4963,11.4148
40456283000103,"LUSÍADAS FUNDO DE INVESTIMENTO FINANCEIRO MULTIMERCADO","BTG WM",130.849,92.049,42.716,20.8576,9.7192
40476059000175,"ITAÚ VHC FUNDO DE INVESTIMENTO FINANCEIRO MULTIMERCADO CRÉDITO PRIVADO RESPONSABILIDADE LIMITADA","IAM",79.9322,161.062,69.6129,33.991,15.8391
40764095000134,"UBS DI SPECIAL FUNDO DE INVESTIMENTO RENDA FIXA REFERENCIADO  RESPONSABILIDADE LIMITADA","UBS",104.3613,103.4897,51.0944,24.9487,11.6256
40783237000100,"AZ QUEST MULTI MAX PREV MASTER FIFE FUNDO DE INVESTIMENTO FINANCEIRO MULTIMERCADO RESP LTDA","AZ Quest",139.3769,112.1432,45.3027,22.1207,10.3078
40815606000108,"MONTE BRAVO SIRIUS FI FINANCEIRO MULTIMERCADO CRÉDITO PRIVADO - RESPONSABILIDADE LIMITADA","Monte Bravo",-51.7735,53.4404,36.7141,17.927,8.3536
40832863000140,"CAIXA RM PREVINVEST PREVIDENCIARIO FIF RENDA FIXA CRÉDITO PRIVADO - RESPONSABILIDADE LIMITADA","CEF Asset",104.8096,104.3448,51.59,25.1907,11.7384
40897658000162,"BUTIÁ PLUS FUNDO DE INVESTIMENTO FINANCEIRO RENDA FIXA","Butiá",94.0034,107.0181,53.429,26.0886,12.1568
41128444000194,"VALORA PREVIDÊNCIA FIFE FIF RENDA FIXA CRÉDITO PRIVADO - RESPONSABILIDADE LIMITADA","Valora",95.1809,108.8938,57.5534,28.1025,13.0952
41348601000177,"JVV PREV FUNDO DE INVESTIMENTO FINANCEIRO MULTIMERCADO","BTG WM",232.8841,14.4627,8.7272,4.2613,1.9857
41348664000123,"LEOPARDUS PREVIDÊNCIA FUNDO DE INVESTIMENTO FINANCEIRO MULTIMERCADO","BTG WM",187.9474,100.6316,42.3096,20.6592,9.6268
41348781000197,"ABT PREVIDÊNCIA FUNDO DE INVESTIMENTO FINANCEIRO MULTIMERCADO","BTG WM",102.3429,103.1335,50.691,24.7517,11.5338
41348869000109,"SUMMERCOOL PREVIDÊNCIA FUNDO DE INVESTIMENTO FINANCEIRO MULTIMERCADO","Altera",113.6011,107.8713,52.1981,25.4876,11.8767
41348917000169,"ARGENTUM PREVIDÊNCIA FUNDO DE INVESTIMENTO FINANCEIRO MULTIMERCADO","BTG WM",120.9951,103.6522,49.0277,23.9395,11.1553
41349195000167,"MFY FUNDO DE INVESTIMENTO FINANCEIRO MULTIMERCADO","BTG WM",82.9164,87.8102,39.9679,19.5158,9.094
41349248000140,"KLARA PREV FUNDO DE INVESTIMENTO FINANCEIRO MULTIMERCADO","BTG WM",104.5845,104.0396,50.976,24.8909,11.5987
41544993000140,"MAG CRESOL FIF - CLASSE DE INVESTIMENTO MULT  - RESP  LIMITADA","MAG",114.0332,104.8264,50.2462,24.5345,11.4326
41545043000130,"IBIUNA TOTAL CREDIT FIF - CLASSE DE INVESTIMENTO MULTIMERCADO CRÉD PRIV - RESPONSABILIDADE LIMITADA","Ibuina",121.0975,103.6124,54.6353,26.6776,12.4313
41545586000157,"MOLICO FUNDO DE INVESTIMENTO FINANCEIRO MULT CRÉDITO PRIVADO - RESP LIMITADA","Icatu",121.3167,111.1495,54.1195,26.4258,12.3139
41575809000129,"ARX PREVIDENCIÁRIO FIFE FIF RENDA FIXA CRÉDITO PRIVADO RESPONSABILIDADE LIMITADA","ARX",102.5974,104.7082,51.9509,25.3669,11.8205
41579176000127,"MAG PREVIDÊNCIA BP FUNDO DE INVESTIMENTO FINANCEIRO RENDA FIXA CRÉDITO PRIVADO - RESP LIMITADA","MAG",118.754,104.5808,49.07,23.9602,11.165
41601781000157,"AMW ARTEMIS FIFE FIF RF PREVIDENCIÁRIO CRÉDITO PRIVADO - RESPONSABILIDADE LIMITADA","AMW",132.4793,105.4654,52.7156,25.7403,11.9945
41610657000158,"SULAMÉRICA FF FUNDO DE INVESTIMENTO FINANCEIRO RENDA FIXA CRÉDITO PRIVADO RESPONSABILIDADE LIMITADA","Sulamérica",89.1787,86.2257,42.0054,20.5107,9.5576
41649957000140,"ITAÚ CRÉDITO ESTRUTURADO ALPES MASTER FIF MULTIMERCADO CRÉDITO PRIVADO RESP LIMITADA","IAM",243.8239,-140.1609,-48.5437,-23.7063,-11.0489
41672242000109,"CAPITÂNIA PREV ADVISORY XP SEGUROS FIFE FIF RENDA FIXA CRÉDITO PRIVADO - RESPONSABILIDADE LIMITADA","Capitânia",80.2359,21.436,19.7384,9.638,4.4911
41672376000120,"ARX METRUS 2 FUNDO DE INVESTIMENTO FINANCEIRO RENDA FIXA CRÉDITO PRIVADO - RESPONSABILIDADE LIMITADA","ARX",87.9716,91.0177,44.6977,21.8252,10.1701
41681275000115,"ITAÚ INSTITUCIONAL PRECISION CRÉDITO PRIVADO RENDA FIXA LONGO PRAZO FIF RESP LIMITADA","IAM",114.1363,116.6663,54.3235,26.5254,12.3603
41681780000160,"EQI CRÉDITO FIFE PREVIDÊNCIA FUNDO DE INVESTIMENTO FINANCEIRO MULTIMERCADO","EQI",123.4231,113.4529,56.393,27.5359,12.8312
41709727000120,"CAPITÂNIA PREV ITAÚ FIFE FUNDO DE INVESTIMENTO FINANCEIRO MULTIMERCADO CRÉDITO PRIVADO RESP LIMITADA","Capitânia",158.4078,105.5731,46.48,22.6955,10.5757
41722175000190,"SANTANDER FUNPRESP RENDA FIXA CRÉDITO PRIVADO - FIF RESP LIMITADA","SAM",273.3866,108.0009,31.698,15.4777,7.2123
41727038000148,"BB IVI 27 FUNDO DE INVESTIMENTO FINANCEIRO MULTIMERCADO CRÉDITO PRIVADO LONGO PRAZO","BB Asset",266.4002,128.7565,41.9199,20.4689,9.5381
41734999000180,"ITAÚ BTG PACTUAL CORPORATIVO PLUS FIFE PREV FIF MULTIMERCADO CRÉDITO PRIVADO RESP LIMITADA","BTG Asset",202.4604,148.7961,71.4139,34.8704,16.2489
41736548000181,"ITAÚ BTG PACTUAL CRÉDITO CORPORATIVO PREVIDÊNCIA FIF RENDA FIXA CRÉDITO PRIVADO LP RESP LIMITADA","BTG Asset",130.988,117.3215,56.6902,27.681,12.8988
41756159000118,"KINEA ALPES PREV RENDA FIXA CRÉDITO PRIVADO FUNDO DE INVESTIMENTO FINANCEIRO RESP LIMITADA","Kinea",115.2273,113.8189,53.5493,26.1474,12.1842
41774687000108,"BTG PACTUAL CORPORATIVO PLUS PREV FIFE FUNDO DE INVESTIMENTO FINANCEIRO MULTIMERCADO","BTG Asset",164.5321,132.7551,60.7497,29.6632,13.8225
41776707000171,"ICATU VANGUARDA ABSOLUTO PLUS INFLAÇÃO QUALIFICADO IU FIFE FIF RF CRED PRIV PREV - RESP LIMITADA","Icatu",236.7699,118.4024,39.9216,19.4932,9.0834
41776781000198,"ICATU VANGUARDA ABSOLUTO PLUS QUALIFICADO IU FIFE FIF RF CRED PRIV PREVIDENCIÁRIO RESP LIMITADA","Icatu",133.5414,121.5206,57.3903,28.0229,13.0581
41837660000109,"EMB VI A FIF  - CLASSE DE INVESTIMENTO RF  CRÉDITO PRIV  - RESP  LIMITADA","Icatu",234.2147,103.6239,33.6395,16.4257,7.6541
41837736000104,"FUNDO DE INVESTIMENTO FINANCEIRO - CLASSE DE INVESTIMENTO  MULT CRED PRIV BVP 421 - RESP LIMITADA","BRAM",205.4623,96.9,38.5317,18.8145,8.7672
41867517000160,"JGP CRÉDITO PREVIDENCIÁRIO ITAÚ RENDA FIXA FIF CRÉDITO PRIVADO FIFE RESPONSABILIDADE LIMITADA","JGP",114.18,109.9571,56.462,27.5696,12.8469
41881271000180,"TRANCOSO FUNDO DE INVESTIMENTO FINANCEIRO MULTIMERCADO","Inter",-1.5016,116.8748,59.997,29.2957,13.6512
41888721000167,"PRINCIPAL CLARITAS LIQUIDEZ MASTER FUNDO DE INVESTIMENTO FINANCEIRO MULTIMERCADO","Principal",105.8179,93.7008,45.4208,22.1783,10.3347
41978506000157,"KINEA FUNDO DE INVESTIMENTO FINANCEIRO RENDA FIXA CRÉDITO PRIVADO RESPONSABILIDADE LIMITADA","Kinea",121.4598,117.8574,56.5086,27.5924,12.8575
42014178000131,"SPX SEAHAWK PLUS PREVIDENCIÁRIO FIF MULTIMERCADO CRÉDITO PRIVADO RESPONSABILIDADE LIMITADA","SPX",118.0232,89.1429,48.7017,23.7804,11.0812
42044315000180,"VINCI IRB CRÉDITO FI RF CP FIF - CLASSE DE INVESTIMENTO RENDA FIXA CRÉDITO PRIVADO - RESP LIMITADA","Vinci",112.3162,114.1257,56.6277,27.6505,12.8846
42119476000196,"IBIUNA CREDIT PREV FIFE FIF - CLASSE DE INVESTIMENTO MULTIMERCADO CRED PRIV I - RESP LIMITADA","Ibuina",105.976,104.2376,52.9011,25.8309,12.0367
42220424000101,"SANTANDER PB ALOCAÇÃO RENDA FIXA CRÉDITO PRIVADO - CIC FIF","San WM",104.3833,106.0921,51.2843,25.0414,11.6688
42220446000171,"SANTANDER PREV PB ALOCAÇÃO RF CRÉD PRIV - FIF RESP LIMITADA","San WM",102.0323,103.3064,50.3888,24.6042,11.4651
42229399000127,"KINEA ANDES PREV RENDA FIXA CRÉDITO PRIVADO FIF RESP LIMITADA","Kinea",116.0263,113.2618,54.2104,26.4702,12.3346
42246480000115,"SOLIS ANTARES PREVIDÊNCIA CRÉDITO PRIVADO FUNDO DE INVESTIMENTO DE RENDA FIXA","Solis",116.6476,117.0647,54.5465,26.6343,12.4111
42264017000104,"ITAÚ HIGH YIELD ALL MULTIMERCADO CRÉDITO PRIVADO FIF RESP LIMITADA","IAM",112.3055,115.9505,54.0333,26.3837,12.2943
42282188000158,"ITAÚ HIGH YIELD II PREV DISTRIBUIDORES XP FIF MULT CRÉD PRIV - RESP LIMITADA","IAM",107.4344,110.5557,52.2385,25.5073,11.8859
42294333000110,"PMAR FUNDO DE INVESTIMENTO FINANCEIRO RENDA FIXA CRÉDITO PRIVADO RESPONSABILIDADE LIMITADA","Inter",100.6902,107.6907,52.2599,25.5178,11.8908
42417749000189,"XP TOP CREDIT MASTER PREVIDENCIÁRIO FIF RENDA FIXA CRÉDITO PRIVADO RESPONSABILIDADE LIMITADA","XPG",131.8602,117.3699,58.371,28.5017,13.2813
42449373000194,"TIVIO MASTER FIFE FIF RENDA FIXA PREVIDENCIÁRIO CRÉDITO PRIVADO RESPONSABILIDADE LIMITADA","Tivio",109.465,110.4168,54.2449,26.487,12.3424
42449381000130,"LEGACY CAPITAL PREVIDENCIÁRIO FIFE FIF RENDA FIXA CRED PRIV RESP LIMITADA","Legacy",119.7783,115.5147,51.5623,25.1771,11.7321
42535073000128,"MONT BLANC FUNDO DE INVESTIMENTO FINANCEIRO RF CRÉD PRIV RESP LIMITADA","Vinci",125.5752,99.2038,45.9466,22.4351,10.4543
42682169000119,"ONNIX PREVIDÊNCIA FUNDO DE INVESTIMENTO FINANCEIRO MULTIMERCADO","BTG WM",220.866,106.0207,42.2269,20.6188,9.608
42682358000191,"GREEN PREVIDÊNCIA FUNDO DE INVESTIMENTO FINANCEIRO MULTIMERCADO","BTG WM",111.8652,103.6882,49.8588,24.3454,11.3445
42682380000131,"MANACOR PREV FUNDO DE INVESTIMENTO FINANCEIRO MULTIMERCADO","BTG WM",132.4314,87.5416,42.0673,20.5409,9.5717
42682447000138,"CM OROBÓ II PREVIDÊNCIA FUNDO DE INVESTIMENTO FINANCEIRO MULTIMERCADO","BTG WM",103.0579,84.6165,40.3443,19.6996,9.1796
42699050000159,"ITAÚ FLEXPREV SINFONIA FIF MULTIMERCADO CRÉDITO PRIVADO - RESPONSABILIDE LIMITADA","IAM",111.5939,114.8482,53.2726,26.0122,12.1212
42717986000165,"ITAÚ SINFONIA MULTIMERCADO CRÉDITO PRIVADO FUNDO DE INVESTIMENTO FINANCEIRO RESP LIMITADA","IAM",113.6314,121.5429,55.1697,26.9386,12.5529
42730970000192,"BTG PACTUAL CREDITO CORPORATIVO ESG FUNDO DE INVESTIMENTO FINANCEIRO RENDA FIXA","BTG Asset",101.9234,100.4152,49.7023,24.2689,11.3088
42736995000101,"ITAÚ DIFERENCIADO FUNDO DE INVESTIMENTO FINANCEIRO RENDA FIXA CRÉDITO PRIVADO RESP LIMITADA","IAM",104.4244,56.6675,19.737,9.7438,4.5384
42747172000173,"CAPITÂNIA K FUNDO DE INVESTIMENTO FINANCEIRO MULTIMERCADO","Capitânia",83.3428,64.2721,32.8491,16.0397,7.4742
42774252000118,"MONTE BRAVO HIGH GRADE FUNDO DE INVESTIMENTO FINANCEIRO RENDA FIXA","Monte Bravo",117.0884,112.2182,55.9936,27.3409,12.7403
42777239000112,"PORTO PREVIDENCIÁRIO FIFE FUNDO DE INVESTIMENTO FINANCEIRO RENDA  FIXA CRÉDITO PRIVADO RESP LIMITADA","Porto Asset",109.983,108.3765,50.9752,24.8905,11.5985
42813742000186,"AQUAPREV II FUNDO DE INVESTIMENTO FINANCEIRO MULTIMERCADO","BTG WM",265.1971,108.0391,39.5726,19.3228,9.004
42813751000177,"FEXY PREVIDÊNCIA FUNDO DE INVESTIMENTO MULTIMERCADO","BTG WM",172.0019,104.8328,38.6152,18.8553,8.7862
42814813000165,"ITAÚ HIGH YIELD PREV DISTRIBUIDORES BP FIF RF CRÉD PRIV - RESP LIMITADA","IAM",108.6414,110.8756,52.2265,25.5015,11.8832
42814944000142,"ITAÚ FLEXPREV HIGH YIELD II FUNDO DE INVESTIMENTO FINANCEIRO MULT CRÉD PRIV - RESP LIMITADA","IAM",107.8033,111.2888,52.523,25.6462,11.9506
42827176000161,"CAPITÂNIA REIT PREV ITAÚ FIFE FIF MULTIMERCADO CRÉDITO PRIVADO RESPONSABILIDADE LIMITADA","Capitânia",161.0366,28.643,15.7632,7.6969,3.5866
42847253000145,"DIEGO 10 PREVIDÊNCIA FUNDO DE INVESTIMENTO FINANCEIRO MULTIMERCADO","BTG WM",138.7307,89.8578,41.8298,20.4249,9.5176
42847342000191,"CAPITÂNIA BWM FUNDO DE INVESTIMENTO FINANCEIRO MULTIMERCADO","Capitânia",120.3925,120.8226,62.2514,30.3965,14.1642
42848014000100,"BTG LEGATO VC FUNDO DE INVESTIMENTO FINANCEIRO MULTIMERCADO","BTG Asset",140.9394,120.4136,46.3488,22.6315,10.5458
42865247000110,"BRZ IRB FIF - CLASSE DE INVESTIMNTO RF CRÉDITO PRIVADO - RESPONSABILIDADE LIMITADA","BRZ",124.4971,117.6852,60.7553,29.666,13.8238
42865719000135,"SULAMÉRICA CRÉDITO INFLAÇÃO FIF - CLASSE DE INVESTIMENTO RF CRED PRIV LP - RESP LIMITADA","Sulamérica",102.3962,88.7447,39.334,19.2063,8.9497
42870959000128,"AQUILA 7 CRÉDITO PRIVADO FI FINANCEIRO RENDA FIXA LONGO PRAZO - RESPONSABILIDADE LIMITADA","Capitânia",83.3824,102.844,54.654,26.6868,12.4355
42922268000120,"DAYCOVAL FUNPRESP FUNDO DE INVESTIMENTO FINANCEIRO","Daycoval",122.9145,107.6386,48.9761,23.9143,11.1436
42934049000161,"CAPITÂNIA PREVIDENCE ITAÚ FIFE FIF RENDA FIXA CRÉDITO PRIVADO RESPONSABILIDADE LIMITADA","Capitânia",120.6676,113.211,57.1855,27.9229,13.0115
43103846000160,"BTG PACTUAL CRÉDITO CORPORATIVO PREV IPCA FUNDO DE INVESTIMENTO RENDA FIXA CRÉDITO PRIVADO","BTG Asset",273.7612,65.0573,20.5109,10.0152,4.6669
43164438000118,"POLO CRÉDITO ESTRUTURADO 90 FUNDO DE INVESTIMENTO FINANCEIRO MULTIMERCADO","Polo",170.0661,134.5581,55.8374,27.2646,12.7048
43450518000130,"AMW VÊNUS MASTER CRÉDITO FUNDO DE INVESTIMENTO FINANCEIRO MULTIMERCADO","AMW",159.0531,130.6523,63.0569,30.7898,14.3474
43508859000119,"TITANIUM HIGH YIELD FUNDO DE INVESTIMENTO FINANCEIRO RENDA FIXA","Lifetime",89.4172,97.6286,46.7457,22.8253,10.6361
43584015000157,"CHROMO MAKAPUU FUNDO DE INVESTIMENTO MULTIMERCADO","Chromo",173.6408,41.4433,-6.7278,-3.2851,-1.5308
43584575000101,"AMARILLYS FUNDO DE INVESTIMENTO MULTIMERCADO","Sonata",199.0237,99.5202,40.1742,19.6165,9.1409
43584990000165,"UBS PREV 1965 II FUNDO DE INVESTIMENTO FINANCEIRO MULTIMERCADO CRÉDITO PRIVADO - RESP LIMITADA","UBS",102.3148,33.8533,40.2547,19.6584,9.1623
43597393000175,"VERDE AM CARRY MASTER FUNDO DE INVESTIMENTO FINANCEIRO MULTIMERCADO CRÉDITO PRIVADO RESP LIMITADA","Verde",-111.8958,-30.5584,17.6737,8.6298,4.0213
43619743000157,"SANTANDER HAPVIDA ANS RENDA FIXA CRÉDITO PRIVADO - FUNDO DE INVESTIMENTO FINANCEIRO RESP LIMITADA","SAM",104.9226,103.608,51.0877,24.9454,11.6241
43631871000116,"EURÁSIA PREVIDÊNCIA FUNDO DE INVESTIMENTO MULTIMERCADO CRÉDITO PRIVADO RESPONSABILIDADE LIMITADA","XPG",145.5992,185.4882,64.3374,31.4151,14.6388
43636081000123,"MAESTRANZA PREV FUNDO DE INVESTIMENTO MULTIMERCADO CRÉDITO PRIVADO RESPONSABILIDADE LIMITADA","XPG",696.556,257.8951,35.3347,17.2534,8.0398
43636102000100,"ABSOLUTO MM PREV FUNDO DE INVESTIMENTO MULTIMERCADO CRÉDITO PRIVADO RESPONSABILIDADE LIMITADA","XPG",80.6532,98.1436,49.6938,24.2648,11.3069
43737615000108,"SPARTA PREVIDÊNCIA INFLAÇÃO MASTER IU FIF RENDA FIXA CRÉDITO PRIVADO RESPONSABILIDADE LIMITADA","Sparta",213.0881,104.4527,35.8887,17.524,8.1658
43760546000153,"SPARTA PREVIDÊNCIA INFLAÇÃO MASTER FIF RENDA FIXA CRÉDITO PRIVADO - RESPONSABILIDADE LIMITADA","Sparta",211.5692,103.8027,35.6905,17.4272,8.1207
43778949000120,"XP CORPORATE LIGHT CRÉDITO PRIVADO XP SEGUROS MASTER FI FINANCEIRO RENDA FIXA RESP LIMITADA","XPG",106.572,106.8276,52.4038,25.588,11.9235
43915486000109,"RIZA LOTUS PLUS MASTER FUNDO DE INVESTIMENTO FINANCEIRO RENDA FIXA","Riza",111.1869,117.2991,58.1503,28.394,13.231
44025131000107,"AF HORIZONTE FUNDO DE INVESTIMENTO FINANCEIRO MULTIMERCADO","AF Invest",136.1061,111.7249,53.9264,26.3315,12.27
44196930000138,"CSHG SISPRIME DO BRASIL FUNDO DE INVESTIMENTO FINANCEIRO - MULT CRED PRIV RESPONSABILIDE LIMITADA","UBS",104.5729,107.6202,51.4944,25.1473,11.7205
44211989000158,"BNP PARIBAS FIFE FI FINANCEIRO - CI MULT CRED PRIV - RESP LIMITADA","BNP",111.856,108.4826,53.0637,25.9103,12.0737
44212092000149,"ALPES FIFE FI FINANCEIRO - CI RF CRED PRIV - RESP LIMITADA","ARX",108.6228,106.1808,49.3868,24.1149,11.2371
44212217000130,"ATENA PREVIDÊNCIA FIFE FUNDO DE INVESTIMENTO FINANCEIRO RENDA FIXA","Atena",117.9046,115.4466,58.1807,28.4088,13.2379
44212301000154,"ICATU VANGUARDA IPORÃ PG INFLAÇÃO FIF CLASSE DE INVESTIMENTO MULTIMERCADO CRÉD PRIV RESP LIMITADA","Icatu",265.9449,122.3363,41.5166,20.272,9.4464
44230868000153,"VINCI CRÉDITO ADVISORY PREV XP SEG FIF RENDA FIXA CRÉDITO PRIVADO - RESPONSABILIDADE LIMITADA","Vinci",118.6424,114.0786,57.4121,28.0335,13.0631
44347394000124,"BTG PACTUAL CRÉDITO CORPORATIVO IPCA FUNDO DE INVESTIMENTO FINANCEIRO RENDA FIXA","BTG Asset",282.7047,107.8943,32.7599,15.9962,7.4539
44371942000151,"UBS EVOLUTION DI BR MASTER FUNDO DE INVESTIMENTO RENDA FIXA REFERENCIADO  RESPONSABILIDADE LIMITADA","UBS",102.3088,102.9826,50.7162,24.764,11.5396
44409284000140,"COMMANDER PREV FUNDO DE INVESTIMENTO MULTIMERCADO CRÉDITO PRIVADO RESPONSABILIDADE LIMITADA","XPG",84.7161,90.2528,48.7439,23.801,11.0908
44434922000182,"CARTOR INSIGNIA FUNDO DE INVESTIMENTO FINANCEIRO RENDA FIXA","Cartor",101.2987,102.346,49.9145,24.3725,11.3571
44459125000150,"REAL FUNDO DE INVESTIMENTO MULTIMERCADO CRÉDITO PRIVADO","AF Invest",0,67.5558,39.7012,19.3856,9.0333
44574326000106,"RIZA EVI MASTER PREVIDENCIA FUNDO DE INVESTIMENTO FINANCEIRO MULTIMERCADO","Riza",368.611,134.1467,59.146,28.8802,13.4576
44672936000134,"WISE LIFE PREVIDÊNCIA FUNDO DE INVESTIMENTO FINANCEIRO MULTIMERCADO","Wise",9.2403,-19.7044,-4.2246,-2.0628,-0.9612
44703439000156,"IBIUNA CREDIT PREV FIFE FIF - CLASSE DE INVESTIMENTO MULTIMERCADO CRED PRIV II - RESP LIMITADA","Ibuina",104.6457,104.0204,52.9257,25.8429,12.0423
44748987000100,"XPA MUCC PREV FUNDO DE INVESTIMENTO MULTIMERCADO CRÉDITO PRIVADO RESPONSABILIDADE LIMITADA","XPG",135.5463,98.5028,38.8984,18.996,8.8536
44764166000150,"XVI CAPITAL RENDA FIXA FUNDO DE INVESTIMENTO FINANCEIRO","XVI",110.8133,108.1819,48.4021,23.6494,11.0313
44835820000179,"CAP PREV INFLAÇÃO 30 ADV XP SEG FIF RENDA FIXA CRÉDITO PRIVADO FIFE - RESPONSABILIDADE LIMITADA","Capitânia",190.354,72.5598,12.4203,6.0647,2.826
44870067000152,"RIZA HIGH GRADE MASTER FUNDO DE INVESTIMENTO FINANCEIRO RENDA FIXA CRÉDITO PRIVADO RESP LIMITADA","Riza",112.7392,111.9287,55.7189,27.2068,12.6778
44903727000154,"LOCUS FUNDO DE INVESTIMENTO FINANCEIRO","Warren",131.868,131.3481,55.5754,26.9167,12.6578
44917374000141,"ICATU VANGUARDA LIQUIDEZ FIF- CLASSE DE INVESTIMENTO RF CRÉDITO PRIVADO LONGO PRAZO - RESP LIMITADA","Icatu",121.0587,112.2603,53.5713,26.1581,12.1892
44917472000189,"LIBERTAS HIGH YIELD FIF - CLASSE DE INVESTIMENTO RENDA FIXA CRÉDITO PRIVADO - RESP LIMITADA","Vinci",201.0959,109.5675,44.0304,21.4994,10.0183
44917492000150,"LIBERTAS HIGH GRADE FIF - CLASSE DE INVESTIMENTO MULTIMERCADO CRÉDITO PRIVADO - RESP LIMITADA","BNP",103.8155,106.6446,51.7077,25.2481,11.7651
44967444000176,"INTEGRAL CASH FUNDO DE INVESTIMENTO FINANCEIRO RENDA FIXA","Integral",105.1539,105.9575,51.6788,25.234,11.7586
44977584000125,"VOX DESENVOLVIMENTO SUSTENTÁVEL IS FUNDO DE INVESTIMENTO FINANCEIRO RENDA FIXA","Vox",95.3177,102.2907,48.7189,23.7918,11.0888
44980461000143,"VIVALDI LIQUIDEZ FUNDO DE INVESTIMENTO FINANCEIRO MULTIMERCADO","BTG WM",107.6968,106.9824,53.2182,25.9857,12.1088
45103998000198,"JIVE SOUL 177 PREV FIFE FUNDO DE INVESTIMENTO MULTIMERCADO CRÉDITO PRIVADO RESP LIMITADA","Jive",106.6939,101.4573,50.1338,24.4796,11.407
45104170000154,"VICTOREM FUNDO DE INVESTIMENTO FINANCEIRO","Galapagos",121.0724,102.8031,49.0415,23.9463,11.1585
45295157000120,"VALORA ARKA FUNDO DE INVESTIMENTO FINANCEIRO MULTIMERCADO","Valora",186.6993,124.7059,64.9744,31.7261,14.7837
45295606000130,"BRASILPREV TOP TP III FIF RENDA FIXA CRÉDITO PRIVADO RESPONSABILIDADE LIMITADA","BB Asset",58.8709,102.295,54.2539,26.4914,12.3445
45302406000167,"BRADESCO MÁSTER CRÉDITO INFLAÇÃO FI FINANCEIRO - CI RF CRED PRIV - RESP LIMITADA","BRAM",216.5451,111.4919,39.5196,19.2969,8.992
45386487000120,"GUARDIAN ICATU PREV FI FINANCEIRO - CI RF CRED PRIV - RESP LIMITADA","Guardian",100.8505,101.6628,50.011,24.4197,11.3791
45443993000104,"NOVUS CRÉDITO HIGH GRADE FUNDO DE INVESTIMENTO MULTIMERCADO LONGO PRAZO","Novus",106.1551,109.7228,54.3163,26.5219,12.3587
45444067000153,"ICATU VANGUARDA ABSOLUTO PLUS FIFE FIF - CLASSE DE INVESTIMENTO RF CRÉDITO PRIVADO - RESP LIMITADA","Icatu",136.5791,116.9187,56.8733,27.7704,12.9405
45444101000190,"ICATU VANGUARDA ABSOLUTO PLUS QUALIFICADO FIF RENDA FIXA CRED PRIV PREVIDENCIÁRIO - RESP LIMITADA","Icatu",127.6129,112.7996,54.489,26.6062,12.398
45494496000135,"AZ QUEST LUCE PREV MASTER FIFE FIF RENDA FIXA CRÉDITO PRIVADO RESP LIMITADA","AZ Quest",127.3004,117.4242,56.165,27.4246,12.7793
45511206000114,"SOMMA FIRENZE FI FINANCEIRO - CI RF CRED PRIV LP - RESP LIMITADA","Somma",115.0147,108.0495,57.2748,27.9665,13.0318
45642714000131,"SULAMÉRICA PREV CRÉDITO ESG ITAÚ MASTER INVESTIMENTO SUSTENTÁVEL FIF RF CRÉD PRIV RESP LIMITADA","Sulamérica",110.0611,109.7433,54.3828,26.5543,12.3738
45645190000132,"VLGI ASSET PREVIDENCIÁRIO I FUNDO DE INVESTIMENTO MULTIMERCADO CRÉDITO PRIVADO RESP LIMITADA","VLGI",147.3476,101.2811,49.9395,24.3848,11.3628
45646162000130,"BTG PACTUAL CRÉDITO CORPORATIVO II PREVIDÊNCIA FUNDO DE INVESTIMENTO FINANCEIRO RENDA FIXA","BTG Asset",120.9997,115.1547,52.8696,25.8155,12.0295
45646230000160,"RIZA LOTUS PREVIDÊNCIA FUNDO DE INVESTIMENTO FINANCEIRO RENDA FIXA","Riza",109.6255,114.339,55.2566,26.981,12.5726
45656777000147,"IBIUNA CREDIT PREV ITAÚ FIFE FIF MULTIMERCADO CRÉDITO PRIVADO RESPONSABILIDADE LIMITADA","Ibuina",102.8703,107.3304,54.9546,26.8336,12.5039
45682244000130,"PORTO RENDA FIXA SELECTION PREVIDÊNCIA FUNDO DE INVESTIMENTO RENDA FIXA","Porto Asset",131.4432,107.2839,50.0369,24.4323,11.385
45683322000110,"JGP ECOSSISTEMA FI FINANCEIRO MULTIMERCADO CRÉDITO PRIVADO - RESPONSABILIDADE LIMITADA","JGP",169.0661,89.6601,63.5713,31.041,14.4645
45688098000150,"NU YIELD FUNDO DE INVESTIMENTO FINANCEIRO RENDA FIXA CRÉDITO PRIVADO LONGO PRAZO RESP LIMITADA","Nu Asset",111.0996,109.6393,54.4601,26.5921,12.3914
45722996000187,"ITAÚ BTG PACTUAL CRÉDITO CORPORATIVO IPCA PREV FIF RENDA FIXA CRÉDITO PRIVADO RESP LIMITADA","BTG Asset",263.8584,80.6454,33.0075,16.1171,7.5103
45726917000106,"SUL AMÉRICA PRESTIGE STRATEGIE ITAÚ MASTER FIF RENDA FIXA CRÉDITO PRIVADO RESP LIMITADA","Sulamérica",104.904,104.8427,51.6012,25.1961,11.7409
45756554000151,"LISBOA PREV FUNDO DE INVESTIMENTO MULTIMERCADO CRÉDITO PRIVADO RESPONSABILIDADE LIMITADA","Capri",140.9533,93.9905,42.9576,20.9756,9.7742
46082347000121,"LIBERTY FUNDO DE INVESTIMENTO MULTIMERCADO CRÉDITO PRIVADO","XPG",46.5918,48.2358,14.7603,7.2073,3.3584
46098916000127,"OCCAM LIQUIDEZ MASTER FI FINANCEIRO RENDA FIXA CRÉDITO PRIVADO - RESPONSABILIDADE LIMITADA","Occam",114.9963,112.4943,55.5795,27.1387,12.6461
46099626000106,"ARX PREVIDENCIÁRIO S FI FINANCEIRO RENDA FIXA CRÉDITO PRIVADO - RESPONSABILIDADE LIMITADA","ARX",108.3165,109.5628,51.6279,25.2092,11.747
46246589000103,"BTG PACTUAL OABPREV FUNDO DE INVESTIMENTO FINANCEIRO MULTIMERCADO","BTG WM",107.7076,93.9831,45.7571,22.3426,10.4112
46328602000173,"AZ QUEST ALTRO PREV MASTER FIFE FIF MULTIMERCADO CRÉDITO PRIVADO - RESPONSABILIDADE LIMITADA","AZ Quest",119.9913,108.8895,50.9138,24.8605,11.5845
46329357000119,"ROOT CAPITAL HG FI FINANCEIRO MULTIMERCADO CRÉDITO PRIVADO - RESPONSABILIDADE LIMITADA","Root",161.7511,126.6013,58.2616,28.4483,13.2564
46332105000149,"KINEA BVP FIFE FI FINANCEIRO - CI MULT CRED PRIV - RESP LIMITADA","Kinea",111.863,110.8823,53.471,26.1091,12.1663
46334681000125,"SULAMÉRICA PRESTIGE XP SEG PREV FIF RENDA FIXA RESPONSABILIDADE LIMITADA","Sulamérica",98.5143,96.8658,47.6421,23.263,10.8401
46373760000145,"ROOT CAPITAL CRÉDITO HG PREVIDÊNCIA FIF RENDA FIXA CRÉDITO PRIVADO - RESPONSABILIDADE LIMITADA","Root",141.652,119.3178,55.2261,26.9661,12.5657
46385360000150,"JGP CRÉDITO PREVIDENCIÁRIO IPCA MASTER FIF RENDA FIXA CRÉD PRIV LONGO PRAZO - RESP LTDA","JGP",169.9652,107.5541,48.2063,23.5385,10.9685
46401052000170,"JGP CRÉDITO B PREVIDÊNCIA FIFE FI FINANCEIRO - CI MULT CRED PRIV LP - RESP LIMITADA","JGP",128.6946,115.1876,57.2426,27.9508,13.0245
46415283000133,"PATAGÔNIA ONE FUNDO DE INVESTIMENTO FINANCEIRO MULTIMERCADO","Patagônia",131.7309,107.6206,-69.543,-33.9569,-15.8232
46539506000174,"WISE CASH FUNDO DE INVESTIMENTO FINANCEIRO RENDA FIXA","Wise",103.2731,104.4749,51.6089,25.1999,11.7427
46685489000183,"ICATU VANGUARDA  ABSOLUTO II FIFE FIF - CLASSE DE INVESTIMENTO RF CRED PRIV - RESP LIMITADA","Icatu",115.606,108.586,52.481,25.6257,11.9411
46685502000102,"ICATU VANGUARDA ABSOLUTO II FIF RENDA FIXA CRED PRIV PREVIDENCIÁRIO - RESP LIMITADA","Icatu",111.6858,104.9677,50.5969,24.7058,11.5124
46700364000185,"BTG ICATU VANGUARDA ABSOLUTO II FIF  CLASSE DE INVESTIMENTO RF CRÉDITO PRIVADO PREV - RESP LIMITADA","Icatu",114.1397,105.8206,50.7026,24.7574,11.5365
46762380000100,"ICATU VANGUARDA ABSOLUTO INFLAÇÃO FIF RF CRED PRIV PREVIDENCIÁRIO - RESP LIMITADA","Icatu",242.0808,105.8782,29.6124,14.4593,6.7378
46762699000128,"ICATU VANGUARDA ABSOLUTO INFLAÇÃO FIFE FIF RF CRÉDITO PRIVADO - RESPONSABILIDADE LIMITADA","Icatu",244.2046,109.7697,35.2468,17.2105,8.0198
46763213000176,"SOMMA SEPTIMUS FIF - CLASSE DE INVESTIMENTO RF CRÉDITO PRIVADO - RESP LIMITADA","Somma",112.8799,109.5818,56.4183,27.5483,12.837
46975474000150,"KINEA V FUNDO DE INVESTIMENTO FINANCEIRO RENDA FIXA CRÉDITO PRIVADO RESPONSABILIDADE LIMITADA","Kinea",121.585,112.1715,54.7899,26.7532,12.4664
46997370000146,"ARX K2 IVP PREVIDENCIÁRIO INFLAÇÃO CURTA FIF RENDA FIXA CRÉDITO PRIVADO RESP LIMITADA","ARX",312.6686,108.057,27.7649,13.5572,6.3174
46997395000140,"SPARTA PREVIDÊNCIA MASTER IU FIF RENDA FIXA CRÉDITO PRIVADO RESPONSABILIDADE LIMITADA","Sparta",107.9757,108.517,53.1463,25.9506,12.0925
47020699000115,"ICATU VANGUARDA DINÂMICO IPCA XP SEG FUNDO DE INVESTIMENTO MULTIMERCADO CP PREV - RESP LIMITADA","Icatu",207.2832,108.2093,41.0218,20.0303,9.3338
47086196000142,"KILIMA BAHARI PREVIDENCIÁRIO FI MULTIMERCADO CRÉDITO PRIVADO RESPONSABILIDADE LIMITADA","Monte Bravo",0,48.9786,33.1942,16.2083,7.5527
47212494000131,"ICATU VANGUARDA ABSOLUTO II IU FIFE FIF RENDA FIXA CRÉD PRIV LP PREVIDENCIÁRIO - RESP LIMITADA","Icatu",113.0108,106.8392,50.716,24.7639,11.5395
