25234711000151,"BB TOP DI RENDA FIXA REFERENCIADO DI CRÉDITO PRIVADO LONGO PRAZO FIF RESPONSABILIDADE LIMITADA","BB Asset",114.4177,113.6358,57.189,27.9246,13.0123
25307339000166,"UBS MASTER IA CRÉDITO PRIVADO FUNDO DE INVESTIMENTO FINANCEIRO MULT PREVIDENCIÁRIO - RESP LIMITADA","UBS",109.5046,112.3184,53.5493,26.1508,12.1882
25682025000143,"ASA INCOME CLASSE DE INVESTIMENTO RENDA FIXA CRÉDITO PRIVADO - RESPONSABILIDADE LIMITADA","ASA",103.2353,106.1764,52.0539,25.4172,11.8439
26143135000108,"G5 POLARIS PREV ICATU QUALIFICADO FIF - CLASSE DE INVESTIMENTO MULT CRED PRIV - RESP LIMITADA","G5",171.6408,116.9145,62.1566,30.3502,14.1426
26313371000117,"PRINCIPAL CLARITAS UNIMEDVX FUNDO DE INVESTIMENTO FINANCEIRO RENDA FIXA","Principal",114.8979,109.4295,54.1453,26.4384,12.3198
26313391000198,"PW2 FI FINANCEIRO MULTIMERCADO CRÉDITO PRIVADO INVESTIMENTO NO EXTERIOR - RESP LTDA","Polo",231.7576,110.6134,59.8785,29.2379,13.6243
26324274000120,"MULTICOOP FUNDO DE INVESTIMENTO FINANCEIRO RENDA FIXA CRÉDITO PRIVADO RESPONSABILIDADE LIMITADA","BNP",107.097,106.1896,51.9926,25.3872,11.83
26491419000187,"KINEA CRÉDITO PRIVADO PREV RENDA FIXA FUNDO DE INVESTIMENTO FINANCEIRO RESPONSABILIDADE LIMITADA","Kinea",110.6179,108.6992,52.3938,25.5832,11.9213
26498249000162,"CAPITÂNIA PREVIDENCE ADVISORY ICATU FIF RENDA FIXA CRÉDITO PRIVADO RESPONSABILIDADE LTDA","Capitânia",-185.3473,-56.9394,48.9132,23.8836,11.1293
26525450000191,"JGP SELECT PREMIUM FIF MULTIMERCADO CRÉDITO PRIVADO IE - RESPONSABILIDADE LIMITADA","JGP",117.4752,98.8841,55.3297,27.0167,12.5893
26664935000166,"DEVANT AUDAX FUNDO DE INVESTIMENTO FINANCEIRO RESPONSABILIDADE LIMITADA","Devant",118.9287,-186.9414,-85.9634,-41.9747,-19.5594
26703080000135,"PAVILLION FUNDO DE INVESTIMENTO FINANCEIRO MULTIMERCADO","BTG WM",301.2898,136.8065,42.0709,20.5426,9.5725
26803172000197,"NW1 FUNDO DE INVESTIMENTO MULTIMERCADO CREDITO PRIVADO IE - RESPONSABILIDADE LIMITADA","Polo",195.1077,133.4194,62.6295,30.5811,14.2502
26845906000109,"UNIMED INVESTCOOP ANS III FUNDO DE INVESTIMENTO FINANCEIRO RENDA FIXA CRÉDITO PRIVADO RESP LIMITADA","Investcoop",119.5398,111.1488,55.2025,26.9546,12.5603
26861544000131,"GIN&FRED FUNDO DE INVESTIMENTO MULTIMERCADO CRÉDITO PRIVADO","XPG",150.8657,94.7012,38.8075,18.9492,8.8299
26978438000132,"IRIDIUM APOLLO FIF RENDA FIXA CRÉDITO PRIVADO LONGO PRAZO - RESPONSABILIDADE LIMITADA","Iridium",125.1883,106.7407,52.9391,25.8494,12.0453
27293743000153,"SOMMA ANS FUNDO DE INVESTIMENTO FINANCEIRO RENDA FIXA","Somma",109.7629,108.3579,55.2597,26.9825,12.5733
27826059000190,"INTER PREMIUM FUNDO DE INVESTIMENTO FINANCEIRO RENDA FIXA CRÉDITO PRIVADO LONGO PRAZO RESP LIMITADA","Inter",107.8201,99.9074,52.2108,25.4938,11.8796
27883656000156,"DHF FUNDO DE INVESTIMENTO FINANCEIRO","Dynamo",393.5925,235.7374,46.973,22.7504,10.6985
27927529000101,"AEN FUNDO DE INVESTIMENTO FINANCEIRO MULTIMERCADO","BTG WM",99.3907,81.1893,30.4576,14.872,6.9301
28206220000195,"SOMMA TORINO FIF - CI RF CRED PRIV LP - RESP LIMITADA","Somma",109.2302,107.1167,55.6391,27.1678,12.6597
28320857000108,"WESTERN ASSET TOTAL CREDIT RENDA FIXA CRÉDITO PRIVADO FUNDO DE INVESTIMENTO FINANCEIRO RESP LIMITADA","Franklin Templeton",107.8154,110.4987,53.5557,26.1505,12.1856
28581607000121,"4UM FI FINANCEIRO - CI RF CRED PRIV LP - RESP LIMITADA","4UM",120.0332,106.6643,54.2797,26.504,12.3504
28648875000113,"BRASIL PLURAL FOZ DO IGUAÇU FIF RENDA FIXA CRÉDITO PRIVADO LONGO PRAZO - RESPONSABILIDADE LIMITADA","Plural",103.6533,105.6035,51.3179,25.0578,11.6765
28651424000135,"ARTEMIS FUNDO DE INVESTIMENTO FINANCEIRO","SFI",99.2113,115.4057,55.3738,27.0383,12.5993
28767162000179,"JGP CRÉDITO ADVISORY FI FINANCEIRO MULTIMERCADO CRÉDITO PRIVADO - RESPONSABILIDADE LIMITADA","JGP",104.0519,104.6303,57.1674,27.9141,13.0074
28788460000145,"RONDÔNIA FIF - CLASSE DE INVESTIMENTO RENDA FIXA CRÉDITO PRIVADO - RESPONSABILIDADE LIMITADA","Icatu",120.4717,112.4445,55.2281,26.9671,12.5661
28840203000105,"HIGH YIELD MASTER FUNDO DE INVESTIMENTO FINANCEIRO MULTIMERCADO CRÉDITO PRIVADO RESP LIMITADA","IAM",112.2493,116.4936,54.302,26.5149,12.3554
28851713000188,"ITAÚ RENDA FIXA CRÉDITO PRIVADO DIFERENCIADO IQ FUNDO DE INVESTIMENTO FINANCEIRO RESP LIMITADA","IAM",104.9378,108.1756,52.9828,25.8707,12.0553
29044189000104,"AF INVEST GERAES 30 FUNDO DE INVESTIMENTO FINANCEIRO RENDA FIXA","AF Invest",143.3281,120.4589,56.2984,27.4897,12.8097
29106510000120,"CSHG FASSIS FUNDO DE INVESTIMENTO FINANCEIRO - MULTIMERCADO CRÉDITO PRIVADO RESPONSABILIDADE LTDA","UBS",286.0171,106.921,-543.8513,-265.5895,-123.7845
29109266000159,"UNIMED INVESTCOOP ANS FUNDO DE INVESTIMENTO FINANCEIRO MULTIMERCADO CRÉDITO PRIVADO RESP LIMITADA","Investcoop",114.7168,111.2905,55.0566,26.8834,12.5271
29157520000194,"CAIXA DIAMANTE CORPORATIVO FIF RENDA FIXA CRÉDITO PRIVADO LONGO PRAZO - RESP LIMITADA","CEF Asset",100.7354,102.782,51.0515,24.9278,11.6158
29196718000187,"ITAÚ WEALTH IQ MASTER RENDA FIXA REFERENCIADO DI FIF RESP LIMITADA","IAM",101.7596,103.0209,50.7399,24.7756,11.5449
29250121000173,"DAYCOVAL CLASSIC 30 FUNDO DE INVESTIMENTO FINANCEIRO","Daycoval",104.9142,102.1743,51.1031,24.9529,11.6276
29259723000191,"ITAÚ FLEXPREV HIGH YIELD FIF RF CRED PRIV - RESP LIMITADA","IAM",108.0369,110.6152,52.1637,25.4708,11.8689
29259957000139,"SANTANDER TURMALINA RENDA FIXA CRÉDITO PRIVADO - FIF RESP LIMITADA","SAM",103.6029,104.4689,51.1871,24.9939,11.6467
29626006000150,"PRINCIPAL CLARITAS ADVISORY ICATU PREVIDÊNCIA FI FINANCEIRO MULTIMERCADO - RESPONSABILIDADE LIMITADA","Principal",347.924,123.7029,45.6244,22.2777,10.381
29733674000187,"RFT MISSISSIPI FI FINANCEIRO - CI MULT CRED PRIV - RESP LIMITADA","Rafter",122.5631,115.068,57.3905,28.023,13.0582
29734143000109,"TRAFALGAR QUALIFICADO FI FINANCEIRO - CI MULT CRED PRIV - RESP LIMITADA","UBS",153.7299,66.6466,29.3621,14.3371,6.6808
29983496000142,"WESTERN ASSET PREV CREDIT 2 RENDA FIXA FUNDO DE INVESTIMENTO FINANCEIRO CRÉDITO PRIV RESP LIMITADA","Franklin Templeton",102.5128,103.5602,50.3429,24.5817,11.4546
30056825000199,"SAFRA POLARIS FIF CLASSE DE INVESTIMENTO RENDA FIXA CRÉDITO PRIVADO RESPONSABILIDADE LIMITADA","Safra Asset",99.5724,96.3516,48.0346,23.4546,10.9294
30330495000188,"FCOPEL II FUNDO DE INVESTIMENTO RENDA FIXA","Icatu",215.0195,95.0173,32.6931,15.9636,7.4387
30338831000139,"XPA VERTICE CRÉDITO FUNDO DE INVESTIMENTO MULTIMERCADO CRÉDITO PRIVADO","XPG",112.7217,103.8778,42.1475,20.58,9.5899
30338838000150,"CAPITÂNIA CREDPREVIDÊNCIA MÁSTER FI FINANCEIRO RENDA FIXA CRÉDITO PRIVADO RESP LTDA","Capitânia",128.3397,92.3155,56.3267,27.5035,12.8161
30392659000100,"BRAM ULTRA FI FINANCEIRO - CI RF CRED PRIV - RESP LIMITADA","BRAM",113.3447,112.8011,55.2016,26.9542,12.5601
30453289000165,"G5 ALLOCATION FUNDO DE INVESTIMENTO FINANCEIRO MULTIMERCADO","G5",110.8486,106.1183,51.6782,25.2337,11.7584
30506088000189,"AZALEIA FUNDO DE INVESTIMENTO FINANCEIRO MULTIMERCADO CRÉDITO PRIVADO","XPG",109.9492,123.632,57.6897,28.1727,13.1306
30568172000127,"AUGME HIGH GRADE FUNDO DE INVESTIMENTO RENDA FIXA","Augme",65.0304,101.4135,50.5981,24.7064,11.5127
30568485000185,"AUGME INSTITUCIONAL CLASSE DE  INVESTIMENTO RENDA FIXA CRÉDITO PRIVADO - RESP LIMITADA","Augme",-856.2133,-117.3918,-327.5655,-159.9457,-74.5316
30593140000181,"ITAÚ FLEXPREV ACTIVE FIX FIF RF CRÉD PRIV - RESP LIMITADA","IAM",111.0566,111.5412,52.6296,25.6983,11.9749
30608416000158,"TENACE FIF CLASSE DE INVESTIMENTO RENDA FIXA CRÉDITO PRIVADO LONGO PRAZO RESPONSABILIDADE LIMITADA","Safra Asset",105.2847,109.6102,51.2154,25.0077,11.6531
30630324000174,"FCOPEL FUNDO DE INVESTIMENTO FINANCEIRO RENDA FIXA CRÉDITO PRIVADO III RESPONSABILIDADE LIMITADA","JGP",131.6375,110.3874,55.7117,27.2033,12.6762
30869395000124,"SPARTA PREVIDÊNCIA FIFE FUNDO DE INVESTIMENTO FINANCEIRO RENDA FIXA CRÉDITO PRIVADO RESP LTDA","Sparta",97.271,100.2645,49.6477,24.2423,11.2964
31120022000119,"ARX DENALI ICATU PREVIDÊNCIA FI FINANCEIRO RENDA FIXA CRÉDITO PRIVADO - RESPONSABILIDADE LIMITADA","ARX",101.7876,99.8285,53.4385,26.0933,12.159
31217083000107,"ITAÚ ACTIVE FIX DUAL MULTIMERCADO CRÉDITO PRIVADO FUNDO DE INVESTIMENTO FINANCEIRO RESP LIMITADA","IAM",118.2137,116.6714,55.1149,26.9118,12.5404
31247970000110,"JULIUS BAER GESTÃO DE CRÉDITO SELETIVO 120 CRED PRIV FIF MULTIMERCADO - RESPONSABILIDADE LIMITADA","BTG WM",110.0119,110.106,58.6935,28.6592,13.3546
31611340000182,"UBS MASTER PORTFOLIO CRÉDITO PRIVADO FUNDO DE INVESTIMENTO FINANCEIRO  MULTIMERCADO RESP LIMITADA","UBS",111.6969,112.7132,53.738,26.2429,12.2312
31908013000197,"ATENA YIELD MASTER FUNDO DE INVESTIMENTO FINANCEIRO RENDA FIXA","Atena",116.7158,118.335,58.8545,28.7378,13.3913
31961612000174,"XP HIGH GRADE ADVISORY FUNDO DE INVESTIMENTO FINANCEIRO RENDA FIXA CRED PRIV RESP LIMITADA","XPG",102.2186,102.7922,50.5865,24.7007,11.51
31962100000122,"SPARTA PREVIDÊNCIA MASTER FUNDO DE INVESTIMENTO FINANCEIRO RENDA FIXA CRÉDITO PRIVADO RESP LTDA","Sparta",102.1508,105.5712,51.9579,25.3703,11.8221
31963396000104,"DEVANT MAGNA FUNDO DE INVESTIMENTO FINANCEIRO RESPONSABILIDADE LIMITADA","Devant",163.9136,97.8776,38.2113,18.6581,8.6943
31964159000150,"TYTON CRÉDITO FUNDO DE INVESTIMENTO FINANCEIRO MULTIMERCADO","Tyton",128.9697,112.3653,52.0381,25.4095,11.8403
32158371000192,"AZ QUEST B PREVIDÊNCIA FIFE MASTER FI FINANCEIRO - CI MULT - RESP LIMITADA","AZ Quest",112.7332,103.9372,45.8542,22.39,10.4333
32159534000151,"ITAÚ PRECISION ADVANCED FUNDO DE INVESTIMENTO FINANCEIRO  MULTIMERCADO CRÉDITO PRIV RESP LIMITADA","IAM",125.7002,118.427,55.2587,26.9856,12.5773
32225253000150,"IRIDIUM TITAN MASTER FIF RENDA FIXA CRÉDITO PRIVADO - RESPONSABILIDADE LIMITADA","Iridium",147.5266,116.9932,57.6857,28.1671,13.1253
32225995000185,"SPARTA ANS FUNDO DE INVESTIMENTO FINANCEIRO RENDA FIXA","Sparta",100.984,103.9801,50.4811,24.6492,11.4861
32312343000188,"IRIDIUM APOLLO MASTER PREV FI FINANCEIRO RENDA FIXA CRÉDITO PRIVADO -  RESPONSABILIDADE LIMITADA","Iridium",122.917,105.3844,52.2371,25.5066,11.8856
32312678000104,"ARX DENALI PREVIDÊNCIA FI FINANCEIRO RENDA FIXA CRÉDITO PRIVADO - RESPONSABILIDADE LIMITADA","ARX",107.0795,107.5491,52.4155,25.5937,11.9262
32319525000180,"JGP CRÉDITO PREVIDENCIÁRIO MASTER FIF RENDA FIXA CRÉD PRIV LONGO PRAZO - RESPONSABILIDADE LIMITADA","JGP",126.4532,113.3828,58.7592,28.6913,13.3696
32385140000111,"MAG PREV XP SEGUROS ADVISORY FIF RF CRÉD PRIV - RESPONSABILIDADE LIMITADA","MAG",117.4567,103.772,48.6922,23.7757,11.079
32388077000177,"BRAM CAPITAL II FIF - CLASSE DE INVESTIMENTO RENDA FIXA CRÉDITO PRIVADO - RESP LIMITADA","BRAM",114.726,108.9713,53.1362,25.9456,12.0902
32397641000118,"PRINCIPAL CLARITAS BTG PREVIDÊNCIA FUNDO DE INVESTIMENTO FINANCEIRO MULTIMERCADO","Principal",278.1591,104.6586,41.811,20.4157,9.5133
32711923000148,"JUXTA CRUCEM FUNDO DE INVESTIMENTO FINANCEIRO MULTIMERCADO CRÉDITO PRIVADO RESP LIMITADA","IAM",107.0345,104.442,50.8816,24.8448,11.5772
32742673000103,"PRINCIPAL CLARITAS PREVIDÊNCIA FIFE FIF MULTIMERCADO CRÉDITO PRIVADO RESPONSABILIDADE LIMITADA","Principal",104.5699,92.0919,44.8694,21.9091,10.2092
32760072000123,"ICATU VANGUARDA CREDIT PLUS MASTER FIF - CLASSE DE INVESTIMENTO RF CRED PRIV - RESP LIMITADA","Icatu",164.6416,136.7468,65.8624,32.1597,14.9858
32770526000147,"ARX K2 INFLAÇÃO CURTA FI FINANCEIRO MULTIMERCADO CRÉDITO PRIVADO- RESPONSABILIDADE LIMITADA","ARX",316.1979,108.4546,32.3468,15.7945,7.3599
32771072000129,"XP CORPORATE PLUS MASTER FI FINANCEIRO MULTIMERCADO CRÉDITO PRIVADO -  RESPONSABILIDADE LIMITADA","XPG",143.1278,124.7932,63.146,30.8333,14.3677
32990051000102,"KINEA OPORTUNIDADE FUNDO DE INVESTIMENTO FINANCEIRO RENDA FIXA CRÉDITO PRIVADO RESP LIMITADA","Kinea",38155.0006,8798.4056,3081.7939,1504.7969,701.206
33342285000106,"BRZ HIGH GRADE FI FINANCEIRO RENDA FIXA CRÉDITO PRIVADO- RESPONSABILIDADE LIMITADA","BRZ",107.8597,113.3108,54.0419,26.3879,12.2962
33520988000179,"BUTIÁ TOP PREVIDENCIÁRIO FIFE FUNDO DE INVESTIMENTO FINANCEIRO RENDA FIXA","Butiá",106.9249,105.9149,52.0244,25.4028,11.8372
33599991000120,"BTG PACTUAL CREDITO CORPORATIVO PLUS FUNDO DE INVESTIMENTO FINANCEIRO MULTIMERCADO","BTG Asset",170.5631,130.5707,58.4737,28.5519,13.3046
33701828000126,"SULAMÉRICA CRÉDITO ESG FIF RENDA FIXA CRÉDITO PRIVADO LP INVEST SUSTENTÁVEL DE RESP LIMITADA","Sulamérica",111.8411,107.1952,52.9104,25.8354,12.0388
33953262000120,"SPS PREV CLASSE DE INVESTIMENTO  MULTIMERCADO CRÉDITO PRIVADO - RESP LIMITADA","Berkana",182.184,104.7315,44.4528,21.7057,10.1144
34080987000113,"BRADESCO FIF DEDICADO ANS - CLASSE DE INVESTIMENTO RENDA FIXA CRÉDITO PRIVADO - RESP LIMITADA","BRAM",154.3325,119.2147,52.0429,25.4118,11.8414
34081211000118,"ICATU VANGUARDA ABSOLUTO FIFE FIF - CLASSE DE INVESTIMENTO RF CRED PRIV PREVIDENCIÁRIO - RESP  LTDA","Icatu",132.2176,114.7513,57.692,28.1702,13.1268
34109940000135,"BRADESCO GESTÃO FI FINANCEIRO - CI RF CRED PRIV - RESP LIMITADA","BRAM",111.4934,110.1519,54.2937,26.5109,12.3535
34143987000115,"UNIMED MULTIESTRATÉGIA FUNDO DE INVESTIMENTO FINANCEIRO MULTIMERCADO RESP LIMITADA","Vinci",90.1923,90.302,42.3595,20.6835,9.6381
34172479000165,"MINERVA FUNDO DE INVESTIMENTO FINANCEIRO MULTIMERCADO","BTG WM",945.1732,212.4015,65.592,32.0277,14.9243
34270943000156,"CAPITÂNIA PREV BP FUNDO DE INVESTIMENTO FINANCEIRO RENDA FIXA","Capitânia",201.3829,100.0848,45.7969,22.362,10.4203
34369940000174,"ACESSO I FUNDO DE INVESTIMENTO FINANCEIRO MULTIMERCADO CRÉDITO PRIVADO - RESPONSABILIDADE LIMITADA","Angá",-6.8919,-5.9442,-3.2097,-1.5673,-0.7303
34431868000168,"ROOT CAPITAL HIGH YIELD FI FINANCEIRO MULTIMERCADO CRÉDITO PRIVADO - RESPONSABILIDADE LIMITADA","Root",200.807,151.3779,76.6842,37.4438,17.4481
34474470000109,"ARX VINSON MASTER FI FINANCEIRO RENDA FIXA CRÉDITO PRIVADO - RESPONSABILIDADE LIMITADA","ARX",112.1008,110.5213,54.4513,26.5878,12.3894
34474989000197,"ARX DENALI MASTER FIF RENDA FIXA CRÉDITO PRIVADO - RESP LTDA","ARX",107.27,108.5069,52.538,25.6536,11.9541
34475149000149,"XP ADVISORY PORTFOLIO PRIVATE I PREV FIM CRÉDITO PRIVADO RESPONSABILIDADE LIMITADA","XPG",204.9225,234.3094,81.2892,39.6975,18.502
34476006000151,"SANTANDER DINÂMICO RENDA FIXA CRÉDITO PRIVADO - FUNDO DE INVESTIMENTO FINANCEIRO RESP LIMITADA","SAM",117.0283,113.5409,55.9237,27.3068,12.7244
34488907000163,"BRASILPREV TOP TP II FUNDO DE INVESTIMENTO FINANCEIRO RENDA FIXA CRÉDITO PRIVADO RESP LIMITADA","BB Asset",100.1917,101.9123,48.2316,23.5508,10.9742
34525051000159,"SULAMÉRICA CRÉDITO INSTITUCIONAL ESG FIF RF CRED PRIV LONGO PRAZO IS - RESP LIMITADA","Sulamérica",110.1366,105.0397,52.0102,25.3959,11.834
34613727000166,"BB PREVIDÊNCIA TP II FUNDO DE INVESTIMENTO FINANCEIRO RENDA FIXA CRÉDITO PRIVADO RESP LIMITADA","BB Asset",106.5665,103.6139,49.5178,24.1789,11.2669
34781259000139,"ICATU VANGUARDA ABSOLUTO IU FIFE FIF RENDA FIXA CRÉDITO PRIVADO PREVIDENCIÁRIO RESP LIMITADA","Icatu",129.6006,121.854,57.9633,28.3027,13.1885
34799162000153,"BOCOM BBM CORPORATE CREDIT FIF - CLASSE DE INVESTIMENTO RF CRED PRIV - RESP LIMITADA","BBM Asset",112.6249,109.0933,53.8364,26.2876,12.2495
34799393000167,"BOCOM BBM CORPORATE CREDIT HIGH YIELD FIF - CLASSE DE INVESTIMENTO MULT CRED PRIV - RESP LIMITADA","BBM Asset",115.0479,84.0719,45.9279,22.4259,10.45
34962302000162,"ARX EVEREST MASTER FIF RENDA FIXA CRÉDITO PRIVADO - RESPONSABILIDADE LIMITADA","ARX",120.9741,114.2272,57.7131,28.1805,13.1316
35001422000166,"UNIMED INVESTCOOP ANS V FUNDO DE INVESTIMENTO FINANCEIRO RENDA FIXA","BTG Asset",110.6972,111.486,57.3849,28.0203,13.0569
35377796000180,"PORTO SEGURO MASTER FIF RENDA FIXA CRÉDITO PRIVADO LONGO PRAZO RESPONSABILIDADE LIMITADA","Porto Asset",111.9575,111.3265,52.0232,25.4022,11.8369
35399404000184,"COMPASS CREDIT SELECTION FUNDO DE INVESTIMENTO FINANCEIRO RENDA FIXA","Vinci",113.3952,111.8176,54.7237,26.7208,12.4514
35435878000134,"INTER ANS FI FINANCEIRO RENDA FIXA CRÉDITO PRIVADO LONGO PRAZO - RESPONSABILIDADE LIMITADA","Inter",64.8477,88.9061,44.7298,21.8409,10.1775
35491217000126,"SPX SEAHAWK MASTER FUNDO DE INVESTIMENTO FINANCEIRO RENDA FIXA CRÉDITO PRIVADO LP RESP LIMITADA","SPX",129.0601,122.2139,58.0171,28.3289,13.2007
35500650000180,"ITAÚ ACTIVE FIX ESG CRÉDITO PRIVADOMULTIMERCADO INVESTIMENTO SUSTENTÁVEL FIF RESP LIMITADA","IAM",107.4467,110.4881,51.3918,25.0939,11.6933
35600771000102,"STONEX SAFIRA AGRO FUNDO DE INVESTIMENTO FINANCEIRO MULTIMERCADO","Stonex",133.8069,112.421,55.3455,27.0244,12.5928
35609382000130,"ICATU VANGUARDA IPORÃ PG FIF CLASSE DE INVESTIMENTO MULTIMERCADO CRED PRIV - RESP LIMITADA","Icatu",138.5175,128.8358,60.5288,29.5554,13.7722
35646238000173,"SPX SEAHAWK PLUS MASTER FIF MULTIMERCADO CRÉDITO PRIVADO RESPONSABILIDADE LIMITADA","SPX",114.482,76.7456,46.8341,22.8685,10.6563
35765444000100,"BTG LEGATO TB FUNDO DE INVESTIMENTO FINANCEIRO MULTIMERCADO","BTG Asset",100.8612,99.6703,30.3844,14.8363,6.9134
35803277000137,"VALORA PREVIDENCIÁRIO MASTER FUNDO DE INVESTIMENTO RENDA FIXA CRÉDITO PRIVADO","Valora",72.2472,108.6379,65.5807,32.0222,14.9217
35820685000105,"AUGME PREVIDÊNCIA XP SEGUROS FIFE CLASSE DE INVESTIMENTO MULTIMERCADO CRÉDITO PRIVADO  RESP LIMITADA","Augme",125.3106,94.8118,48.6798,23.7696,11.0762
35844780000130,"PENSION FUNDO DE INVESTIMENTO FINANCEIRO CLASSE DE INVESTIMENTO RENDA FIXA CRÉDITO PRIVADO","Safra Asset",103.1112,104.5488,49.6849,24.2604,11.3049
35927084000198,"GPD PREV FUNDO DE INVESTIMENTO MULTIMERCADO CRÉDITO PRIVADO RESPONSABILIDADE LIMITADA","XPG",119.5407,104.0392,64.3357,31.4183,14.6433
35927331000156,"SPARTA PREVIDENCIA FIFE D45 FUNDO DE INVESTIMENTO FINANCEIRO RENDA FIXA CRÉDITO PRIVADO RESP LTDA","Sparta",104.1921,104.4487,51.3179,25.0578,11.6765
36017195000120,"AUGME PREVIDÊNCIA FIFE CLASSE DE  INVESTIMENTO MULTIMERCADO CRÉDITO  PRIVADO - RESP LIMITADA","Augme",117.5286,95.3082,48.1492,23.5106,10.9555
36181909000130,"ONZE ZURICH PREVIDÊNCIA DEFINITIVA FIF - CLASSE DE INVESTIMENTO MULTIMERCADO - RESP LIMITADA","Onze",163.0284,127.3584,61.6095,30.0831,14.0181
36233973000118,"SANTANDER PREV DINÂMICO RENDA FIXA CRÉDITO PRIVADO - FIF RESP LIMITADA","SAM",109.6546,110.3414,54.1571,26.4441,12.3225
36247749000185,"RIZA DAIKON MASTER FUNDO DE INVESTIMENTO FINANCEIRO MULTIMERCADO","Riza",206.3924,141.3049,55.6185,27.1578,12.655
36295878000149,"FONTE BOA FUNDO DE INVESTIMENTO MULTIMERCADO CRÉDITO PRIVADO","Amazonia",139.3436,87.9666,41.8984,20.4584,9.5332
36318479000156,"COMPASS YIELD 30 FUNDO DE INVESTIMENTO FINANCEIRO RENDA FIXA","Vinci",133.3199,122.1487,60.8152,29.6952,13.8374
36327365000172,"CAPITÂNIA REIT PREV ADVISORY XP SEGUROS FIFE FIF MULTIMERCADO CRÉD PRIV - RESPONSABILIDADE LIMITADA","Capitânia",118.8368,-50.6205,-15.8111,-7.7204,-3.5975
36352346000104,"ARX CREDIT OPPORTUNITIES K FIF MULTIMERCADO CRÉDITO PRIVADO - RESPONSABILIDADE LIMITADA","ARX",107.4462,108.758,55.6385,27.1675,12.6595
36352509000140,"AZ QUEST SUPRA MASTER FUNDO DE INVESTIMENTO FINANCEIRO MULTIMERCADO CREDITO PRIVADO","AZ Quest",155.2864,128.2113,57.5717,28.1115,13.0994
36368438000174,"RF TRUCK FIF INVESTIDOR PROFISSIONAL CLASSE DE INVESTIMENTO MULTIMERCADO CRÉDITO PRIVADO","Safra Asset",165.9819,97.8224,39.8016,19.4371,9.0591
36498670000127,"RIZA LOTUS FUNDO DE INVESTIMENTO FINANCEIRO RENDA FIXA","Riza",107.992,108.7499,54.282,26.5051,12.3509
36517858000175,"INTER ICATU PREVIDÊNCIA FIFE FIF - CLASSE DE INVESTIMENTO RF CRED PRIV - RESP LIMITADA","Inter",109.1757,104.2679,51.0191,24.9119,11.6085
36518029000107,"JGP MIRANTE FIF - CLASSE DE INVESTIMENTO RENDA FIXA CRÉDITO PRIVADO - RESP LIMITADA","JGP",123.3515,117.3632,60.6773,29.6279,13.806
36521640000194,"LARANJEIRAS FIF - CLASSE DE INVESTIMENTO MULTIMERCADO CRED PRIV - RESP LIMITADA","Icatu",122.6139,116.8313,58.271,28.4529,13.2585
36521676000178,"WESTERN B PREVIDÊNCIA FIFE MASTER FI FINANCEIRO - CI MULT CRED PRIV - RESP LIMITADA","Franklin Templeton",105.6779,103.6574,50.3131,24.5672,11.4478
36521686000103,"AZ QUEST B PREVIDÊNCIA FIFE MASTER FI FINANCEIRO - CI MULT CRED PRIV - RESP LIMITADA","AZ Quest",113.7478,110.5814,53.1639,25.9592,12.0965
36521750000156,"ICATU VANGUARDA INSTITUCIONAL IS FIF - CLASSE DE INVESTIMENTO RF CRÉDITO PRIVADO - RESP LIMITADA","Icatu",130.0921,119.4704,57.6351,28.1424,13.1138
36532178000120,"CHRONOS FUNDO DE INVESTIMENTO MULTIMERCADO CRÉDITO PRIVADO","XPG",-10.4192,-350.307,-202.2824,-98.7717,-46.0257
36617679000100,"ICATU VANGUARDA MIRANTE FIF - CLASSE DE INVESTIMENO RENDA FIXA CRÉDITO PRIVADO - RESP LIMITADA","Icatu",120.1306,114.0546,53.4696,26.1085,12.166
36620786000197,"GRATIDÃO ICATU QUALIFICADO PREVIDENCIÁRIO CIM CRÉDITO PRIVADO - RESP LIMITADA","Oriz",164.6113,86.5233,39.6049,19.3385,9.0114
36671861000149,"DAYCOVAL CLASSIC 90 FUNDO DE INVESTIMENTO FINANCEIRO","Daycoval",106.5661,105.6965,52.0472,25.4172,11.8463
37099037000129,"VINCI CREDITO MULTIESTRATEGIA FUNDO DE INVESTIMENTO FINANCEIRO MULTIMERCADO","Vinci",122.7805,-80.7335,-42.6273,-20.8143,-9.6991
37235948000136,"BRADESCO MASTER ULTRA PREVIDÊNCIA FI FINANCEIRO - CI RF CRED PRIV - RESP LIMITADA","BRAM",111.3749,108.34,52.2989,25.5368,11.8997
37253989000155,"SANTANDER PREV PB PRINCESA MULT CRÉDITO PRIVADO - FUNDO DE INVESTIMENTO FINANCEIRO RESP LIMITADA","San WM",117.1469,110.457,52.6141,25.6907,11.9714
37266789000137,"SANTANDER PREV PB TSURU MULTIMERCADO CRÉDITO PRIVADO - FIF RESP LIMITADA","San WM",96.4693,53.8221,19.3924,9.4691,4.4124
37267132000194,"SANTANDER PB RICCHEZZA MULTIMERCADO CRÉDITO PRIVADO - FUNDO DE INVESTIMENTO FINANCEIRO","San WM",90.8232,84.1546,41.1246,20.0806,9.3572
37319367000182,"UNIMED INVESTCOOP LIVRE I FIF RENDA FIXA CRÉDITO PRIVADO LP RESP LIMITADA","Investcoop",110.0568,107.7035,53.8743,26.3061,12.2581
37322048000126,"IBIUNA CREDIT FIF - CLASSE DE INVESTIMENTO MULTIMERCADO CRÉDITO PRIVADO - RESP LIMITADA","Ibuina",103.0963,106.858,55.5061,27.1028,12.6294
37331175000191,"UNIMED INVESTCOOP ANS II FUNDO DE INVESTIMENTO FINANCEIRO RENDA FIXA CRÉDITO PRIVADO RESP LIMITADA","Investcoop",108.1785,108.6103,53.2267,25.9899,12.1108
37440121000164,"AUGME PRO VC FUNDO DE INVESTIMENTO FINANCEIRO MULTIMERCADO","Augme",89.1326,108.1454,49.585,24.2117,11.2822
37452819000108,"FRM CLASSE DE INVESTIMENTO RENDA FIXA CRÉDITO PRIVADO -  RESP LIMITADA","UBS",101.0851,102.0824,50.1318,24.4787,11.4066
37539419000126,"XP PREMIUM 30 ADVISORY FIF RENDA FIXA CRÉDITO PRIVADO LONGO PRAZO RESP LIMITADA","XPG",101.7487,105.7036,53.0944,25.9253,12.0807
37626651000100,"LGCY FUNDO DE INVESTIMENTO FINANCEIRO MULTIMERCADO CRÉDITO PRIVADO RESPONSABILIDADE LIMITADA","Legacy",131.2406,125.0464,60.2267,29.4079,13.7035
37805950000101,"WALTER PREV FUNDO DE INVESTIMENTO FINANCEIRO MULTIMERCADO","BTG WM",108.7616,94.805,45.0068,21.9762,10.2405
37842935000125,"CTBG PREVIDÊNCIA FUNDO DE INVESTIMENTO FINANCEIRO MULTIMERCADO","BTG WM",358.3418,54.4516,5.1421,2.5108,1.17
37895276000195,"AZ QUEST SPECIAL K MASTER FUNDO DE INVESTIMENTO FINANCEIRO MULTIMERCADO CREDITO PRIVADO","AZ Quest",133.6862,109.8036,50.507,24.6619,11.4919
37899720000140,"XP PREVENT SENIOR ANS FIF MULTIMERCADO CRÉDITO PRIVADO  -  RESPONSABILIDADE LIMITADA","XPG",107.1878,106.0226,51.8412,25.3133,11.7955
38026869000188,"SPARTA TOP INFLAÇÃO MASTER FIF RENDA FIXA CRÉDITO PRIVADO LONGO PRAZO - RESPONSABILIDADE LIMITADA","Sparta",208.4414,105.5577,36.8989,18.0172,8.3957
38150833000101,"G5 TORONTO FUNDO DE INVESTIMENTO FINANCEIRO MULTIMERCADO","G5",-430.8322,-0.2373,25.8376,12.6161,5.8789
38195881000116,"BUZA FIF- CLASSE DE INVESTIMENTO MULTIMERCADO PREVIDENCIÁRIO - RESPONSABILIDADE LIMITADA","Rafter",140.059,58.9775,28.5567,13.9438,6.4976
38230040000100,"RÉGIA CRÉDITO ESG MASTER FI FINANCEIRO MULTIMERCADO CRÉDITO PRIVADO IS - RESPONSABILIDADE LIMITADA","Regia",91.6156,111.4668,54.3142,26.5209,12.3582
38439714000173,"RDA LIFFE PREV FUNDO DE INVESTIMENTO FINANCEIRO MULTIMERCADO","BTG WM",130.5672,83.1491,39.2525,19.1665,8.9312
38542842000148,"BNP PARIBAS ANAJÉ CLASSE DE  INVESTIMENTO RENDA FIXA CRÉDITO PRIVADO IS RESPONSABILIDADE LIMITADA","BNP",111.024,103.7646,80.6318,39.3714,18.3463
38653941000105,"BRAM INSTITUCIONAL FIF - CLASSE DE INVESTIMENTO RF CRED PRIVADO - RESP LIMITADA","BRAM",119.6899,114.1352,55.1567,26.9322,12.5499
39152991000163,"BRAM IS SUSTENTABILIDADE FIF - CLASSE DE INVESTIMENTO RF CRED PRIV - RESPONSABILIDADE LIMITADA","BRAM",108.662,104.8881,50.9218,24.8644,11.5863
39487617000119,"LEGACY CAPITAL CREDIT FUNDO DE INVESTIMENTO FINANCEIRO MULTIMERCADO - CRÉDITO PRIVADO RESPONSABILIDA","Legacy",123.6971,117.7124,58.1074,28.373,13.2213
39488907000187,"CRESCITA CLASSE DE INVESTIMENTO  MULTIMERCADO CRÉDITO PRIVADO - RESP LIMITADA","UBS",110.0715,99.8365,48.5729,23.7175,11.0519
39502502000156,"AUGME PRO XPA CLASSE DE INVESTIMENTO  MULTIMERCADO CRÉDITO PRIVADO - RESP LIMITADA","Augme",258.1767,48.5079,47.9552,23.4158,10.9113
39511694000167,"TULIPA 18 CLASSE DE INVESTIMENTO  MULTIMERCADO CRÉDITO PRIVADO","Brainvest",157.4854,-22.4066,-10.8116,-5.2791,-2.46
39682386000102,"CAIXA PRIVATE PLUS PREVINVEST PREVIDENCIÁRIO FIF RENDA FIXA CRÉDITO PRIVADO - RESP LIMITADA","CEF Asset",105.7563,108.2538,55.2828,26.9938,12.5786
39958460000162,"M8 CAPITAL PLUS FUNDO DE INVESTIMENTO FINANCEIRO RENDA FIXA","M8",116.5866,110.5116,54.0192,26.3768,12.2911
40022460000135,"IS MÁSTER ESG PREVIDÊNCIA FI FINANCEIRO - CI SUSTENTÁVEL RF CRED PRIV - RESP LIMITADA","BRAM",113.8333,108.152,52.4195,25.5957,11.9271
40142060000163,"BRAM CRÉDITO INFLAÇÃO FI FINANCEIRO - CI RF CRED PRIV - RESP LIMITADA","BRAM",215.2194,108.9087,38.9811,19.0339,8.8694
40152515000121,"RF FUTURE PREVIDÊNCIA FUNDO DE INVESTIMENTO FINANCEIRO MULTIMERCADO","BTG WM",144.3617,79.2569,37.5809,18.3502,8.5508
40152982000151,"TWINS 90 PREVIDÊNCIA FUNDO DE INVESTIMENTO FINANCEIRO MULTIMERCADO","BTG WM",127.3626,92.0874,43.0878,21.0392,9.8038
40153085000162,"ROMA PREV FUNDO DE INVESTIMENTO FINANCEIRO MULTIMERCADO","BTG WM",70.8798,86.6109,44.2131,21.5887,10.0599
